"","book_id","title","author"
"642",14176,"The Whole30: The 30-Day Guide to Total Health and Food Freedom","Melissa Hartwig Urban"
"643",11288,"Diary of a Minecraft Zombie Book 1: A Scare of A Dare","Zack Zombie"
"644",14773,"The Great Gatsby: The Only Authorized Edition","F. Scott Fitzgerald"
"645",11411,"Lost Ocean: An Inky Adventure and Coloring Book for Adults","Johanna Basford"
"646",14194,"The Five Dysfunctions of a Team: A Leadership Fable, 20th Anniversary Edition","Patrick Lencioni"
"647",11166,"The Official SAT Study Guide","The College Board"
"648",12080,"10-Day Green Smoothie Cleanse","JJ Smith"
"649",12653,"The Gifts of Imperfection: Let Go of Who You Think You're Supposed to Be and Embrace Who You Are","Brené Brown"
"650",13022,"Chicka Chicka Boom Boom (Board Book)","Bill Martin Jr."
"651",11587,"The Day the Crayons Came Home","Drew Daywalt"
"652",14556,"What If?: Serious Scientific Answers to Absurd Hypothetical Questions","Randall Munroe"
"653",14607,"Paper Towns","John Green"
"654",13625,"Unbroken: A World War II Story of Survival, Resilience, and Redemption","Laura Hillenbrand"
"655",12282,"Get What's Yours: The Secrets to Maxing Out Your Social Security (The Get What's Yours Series)","Laurence J. Kotlikoff"
"656",13719,"Magnus Chase and the Gods of Asgard, Book 1: The Sword of Summer (Magnus Chase and the Gods of Asgard, 1)","Rick Riordan"
"657",11993,"Dragons Love Tacos","Adam Rubin"
"658",12896,"Fahrenheit 451","Ray Bradbury"
"659",14747,"The Care and Keeping of You: The Body Book for Younger Girls, Revised Edition (American Girl Library)","Valorie Schaefer"
"660",13216,"Potty (Leslie Patricelli board books)","Leslie Patricelli"
"661",12775,"Thing Explainer: Complicated Stuff in Simple Words","Randall Munroe"
"662",12946,"Dead Wake: The Last Crossing of the Lusitania","Erik Larson"
"663",14750,"The Going-To-Bed Book","Sandra Boynton"
"664",12029,"Inspiralized: Turn Vegetables into Healthy, Creative, Satisfying Meals: A Cookbook","Ali Maffucci"
"665",14626,"Mystical Mandala Coloring Book (Dover Mandala Coloring Books)","Alberta Hutchinson"
"666",11984,"Diagnostic and Statistical Manual of Mental Disorders, 5th Edition: DSM-5","American Psychiatric Association"
"667",12199,"Ultimate Sticker Book: Frozen: More Than 60 Reusable Full-Color Stickers","DK"
"668",14971,"The 20/20 Diet: Turn Your Weight Loss Vision Into Reality","Phil McGraw"
"669",11716,"Night (Night)","Elie Wiesel"
"670",14535,"What to Expect When You're Expecting","Heidi Murkoff"
"671",11388,"The Jesus Storybook Bible: Every Story Whispers His Name","Sally Lloyd-Jones"
"672",13174,"The Road to Character","David Brooks"
"673",14009,"Where Is Baby's Belly Button? A Lift-the-Flap Book","Karen Katz"
"674",12498,"The Alchemist, 25th Anniversary: A Fable About Following Your Dream","Paulo Coelho"
"675",13279,"Guess How Much I Love You","Sam McBratney"
"676",12146,"Creative Coloring Inspirations: Art Activity Pages to Relax and Enjoy! (Design Originals) 30 Motivating & Creative Art Activities on High-Quality, Extra-Thick Perforated Pages that Won't Bleed Through","Valentina Harper"
"677",11731,"Little Blue Truck","Alice Schertle"
"678",14573,"The Outsiders","S. E. Hinton"
"679",11780,"Thinking, Fast and Slow","Daniel Kahneman"
"680",11079,"The Everything Kids' Science Experiments Book: Boil Ice, Float Water, Measure Gravity-Challenge the World Around You!","Tom Robinson"
"681",11820,"George Orwell","George Orwell"
"682",11888,"Crucial Conversations Tools for Talking When Stakes Are High, Second Edition","Kerry Patterson"
"683",13647,"Emotional Intelligence 2.0","Travis Bradberry"
"684",13488,"For the Love: Fighting for Grace in a World of Impossible Standards","Jen Hatmaker"
"685",14961,"Press Here (Interactive Book for Toddlers and Kids, Interactive Baby Book) (Press Here by Herve Tullet)","Herve Tullet"
"686",14414,"Little Blue Truck board book","Alice Schertle"
"687",13136,"Brown Bear, Brown Bear, What Do You See?","Bill Martin Jr."
"688",13371,"A Long Walk to Water: Based on a True Story","Linda Sue Park"
"689",14180,"A Game of Thrones / A Clash of Kings / A Storm of Swords / A Feast of Crows / A Dance with Dragons","George R. R. Martin"
"690",12422,"Rogue Lawyer: A Novel","John Grisham"
"691",13469,"Detailed Designs and Beautiful Patterns (Sacred Mandala Designs and Patterns Coloring Books for Adults)","Lilt Kids Coloring Books"
"692",11243,"Lord of the Flies","William Golding"
"693",13367,"Harry Potter and the Cursed Child, Parts 1 & 2, Special Rehearsal Edition Script","J.K. Rowling"
"694",14592,"StrengthsFinder 2.0","Gallup"
"695",14109,"First 100 Words: A Padded Board Book","Roger Priddy"
"696",14850,"The Life-Changing Magic of Tidying Up: The Japanese Art of Decluttering and Organizing","Marie Kondō"
"697",13031,"Oh, the Places You'll Go!","Dr. Seuss"
"698",13093,"Diary of a Wimpy Kid #11: Double Down","Jeff Kinney"
"699",11174,"When Breath Becomes Air","Paul Kalanithi"
"700",14810,"Giraffes Can't Dance","Giles Andreae"
"701",12807,"The 5 Love Languages: The Secret to Love that Lasts","Gary Chapman"
"702",12638,"The Whole30: The 30-Day Guide to Total Health and Food Freedom","Melissa Hartwig Urban"
"703",12067,"A Man Called Ove: A Novel","Fredrik Backman"
"704",13373,"Killing the Rising Sun: How America Vanquished World War II Japan (Bill O'Reilly's Killing Series)","Bill O'Reilly"
"705",12791,"How to Win Friends & Influence People","Dale Carnegie"
"706",13168,"The Magnolia Story","Chip Gaines"
"707",11669,"Laugh-Out-Loud Jokes for Kids","Rob Elliott"
"708",12138,"To Kill a Mockingbird","Harper Lee"
"709",12919,"Hillbilly Elegy: A Memoir of a Family and Culture in Crisis","J. D. Vance"
"710",11313,"Fantastic Beasts and Where to Find Them: The Original Screenplay (Harry Potter)","J.K. Rowling"
"711",12190,"Hamilton: The Revolution","Lin-Manuel Miranda"
"712",14175,"The Girl on the Train","Paula Hawkins"
"713",12972,"Mindset: The New Psychology of Success","Carol S. Dweck"
"714",11545,"The Official SAT Study Guide, 2016 Edition","The College Board"
"715",12811,"Adult Coloring Book Designs: Stress Relief Coloring Book: Garden Designs, Mandalas, Animals, and Paisley Patterns Paperback","Adult Coloring Book Designs"
"716",11456,"The Four Agreements: A Practical Guide to Personal Freedom (A Toltec Wisdom Book)","Don Miguel Ruiz"
"717",11141,"Milk and Honey","Rupi Kaur"
"718",13575,"The Going-To-Bed Book","Sandra Boynton"
"719",15000,"Born to Run","Bruce Springsteen"
"720",14877,"Alexander Hamilton","Ron Chernow"
"721",13492,"The Very Hungry Caterpillar","Eric Carle"
"722",13659,"The 7 Habits of Highly Effective People: Powerful Lessons in Personal Change","Stephen R. Covey"
"723",12094,"The Constitution of the United States","Delegates of the Constitutional Convention"
"724",13030,"Wonder","R. J. Palacio"
"725",13677,"The Wonderful Things You Will Be","Emily Winfield Martin"
"726",13066,"You Are a Badass: How to Stop Doubting Your Greatness and Start Living an Awesome Life","Jen Sincero"
"727",14490,"Thug Kitchen: The Official Cookbook: Eat Like You Give a F*ck (Thug Kitchen Cookbooks)","Thug Kitchen"
"728",12708,"PokÃ©mon Deluxe Essential Handbook: The Need-to-Know Stats and Facts on Over 700 PokÃ©mon","Scholastic"
"729",14870,"Publication Manual of the American Psychological Association, 6th Edition","American Psychological Association"
"730",11593,"Cravings: Recipes for All the Food You Want to Eat: A Cookbook","Chrissy Teigen"
"731",14130,"Between the World and Me","Ta-Nehisi Coates"
"732",14281,"Calm the F*ck Down: An Irreverent Adult Coloring Book","Sasha O'Hara"
"733",11437,"Dear Zoo: A Lift-the-Flap Book","Rod Campbell"
"734",11979,"Jesus Calling, Padded Hardcover, with Scripture references","Sarah Young"
"735",12693,"Night (Night)","Elie Wiesel"
"736",14390,NA,NA
"737",14169,"Harry Potter Paperback Box Set (Books 1-7)","J. K. Rowling"
"738",11139,"Harry Potter and the Sorcerer's Stone: The Illustrated Edition (Harry Potter, Book 1)","J.K. Rowling"
"739",13562,"10-Day Green Smoothie Cleanse","JJ Smith"
"740",13370,"Uninvited: Living Loved When You Feel Less Than, Left Out, and Lonely","Lysa TerKeurst"
"741",14955,"The Nightingale: A Novel","Kristin Hannah"
"742",13420,"Harry Potter and the Chamber of Secrets: The Illustrated Edition (Illustrated) (2)","J. K. Rowling"
"743",14601,"Fahrenheit 451","Ray Bradbury"
"744",12815,"Love You Forever","Robert Munsch"
"745",13386,"The Great Gatsby: The Only Authorized Edition","F. Scott Fitzgerald"
"746",14749,"The Five Dysfunctions of a Team: A Leadership Fable, 20th Anniversary Edition","Patrick Lencioni"
"747",12968,"All the Light We Cannot See","Anthony Doerr"
"748",14786,"Brown Bear, Brown Bear, What Do You See?","Bill Martin Jr."
"749",11964,"The Alchemist, 25th Anniversary: A Fable About Following Your Dream","Paulo Coelho"
"750",13316,"Fervent: A Woman's Battle Plan to Serious, Specific and Strategic Prayer","Priscilla Shirer"
"751",12927,"The Whistler","John Grisham"
"752",11792,"If Animals Kissed Good Night","Ann Whitford Paul"
"753",14857,"Cooking for Jeffrey: A Barefoot Contessa Cookbook","Ina Garten"
"754",14283,"The Trials of Apollo, Book 1: The Hidden Oracle (Trials of Apollo, 1)","Rick Riordan"
"755",13189,"Knock-Knock Jokes for Kids (Laugh-Out-Loud Jokes for Kids)","Rob Elliott"
"756",11104,"Puppy Birthday to You! (Paw Patrol) (Little Golden Book)","Golden Books"
"757",12419,"The Gifts of Imperfection: Let Go of Who You Think You're Supposed to Be and Embrace Who You Are","Brené Brown"
"758",12955,"Crisis of Character: A White House Secret Service Officer Discloses His Firsthand Experience with Hillary, Bill, and How They Operate","Gary J. Byrne"
"759",13931,"First 100 Animals","Roger Priddy"
"760",13430,"Adult Coloring Books: A Coloring Book for Adults Featuring Mandalas and Henna Inspired Flowers, Animals, and Paisley Patterns","Coloring Books for Adults"
"761",14048,"Goodnight Moon","Margaret Wise Brown"
"762",11978,"Daring Greatly: How the Courage to Be Vulnerable Transforms the Way We Live, Love, Parent, and Lead","Brené Brown"
"763",12435,"Miss Peregrine's Home for Peculiar Children (Miss Peregrine's Peculiar Children)","Ransom Riggs"
"764",12047,"Grit: The Power of Passion and Perseverance","Angela Duckworth"
"765",13703,"Emotional Intelligence 2.0","Travis Bradberry"
"766",14241,"The Underground Railroad (Pulitzer Prize Winner) (National Book Award Winner) (Oprah's Book Club): A Novel","Colson Whitehead"
"767",14080,"The Outsiders","S. E. Hinton"
"768",11982,"The Food Lab: Better Home Cooking Through Science","J. Kenji López-Alt"
"769",14848,"Me Before You: A Novel (Movie Tie-In)","Jojo Moyes"
"770",13720,"Chicka Chicka Boom Boom (Board Book)","Bill Martin Jr."
"771",11293,"The Care and Keeping of You: The Body Book for Younger Girls, Revised Edition (American Girl Library)","Valorie Schaefer"
"772",11667,"Potty (Leslie Patricelli board books)","Leslie Patricelli"
"773",11037,"Tools Of Titans: The Tactics, Routines, and Habits of Billionaires, Icons, and World-Class Performers","Timothy Ferriss"
"774",13662,"First 100 Padded: Numbers, Colors, Shapes","Roger Priddy"
"775",13096,"Good Vibes Coloring Book (Coloring is Fun) (Design Originals): 30 Beginner-Friendly & Relaxing Creative Art Activities; Positive Messages & Inspirational Quotes; Perforated Paper Resists Bleed Through","Thaneeya McArdle"
"776",12729,"The Instant Pot Electric Pressure Cooker Cookbook: Easy Recipes for Fast & Healthy Meals","Laurel Randolph"
"777",14007,"Quieting Your Heart: 6-Month Bible-Study Journal","Darlene Schacht"
"778",12484,"The Book with No Pictures","B. J. Novak"
"779",14136,"Creative Haven Owls Coloring Book (Adult Coloring)","Marjorie Sarnat"
"780",11771,"Magnus Chase and the Gods of Asgard, Book 2 The Hammer of Thor (Magnus Chase and the Gods of Asgard, Book 2) (Magnus Chase and the Gods of Asgard, 2)","Rick Riordan"
"781",14191,"Secret Garden: An Inky Treasure Hunt and Coloring Book for Adults","Johanna Basford"
"782",12745,"Harry Potter and the Sorcerer's Stone","J.K. Rowling"
"783",11764,"Dragons Love Tacos","Adam Rubin"
"784",11910,"D&D Player's Handbook (Dungeons & Dragons Core Rulebook)","Dungeons & Dragons"
"785",11483,"The Everything Kids' Science Experiments Book: Boil Ice, Float Water, Measure Gravity-Challenge the World Around You!","Tom Robinson"
"786",12221,"George Orwell","George Orwell"
"787",13083,"The Giver (Giver Quartet, 1)","Lois Lowry"
"788",12489,NA,NA
"789",13601,"Thinking, Fast and Slow","Daniel Kahneman"
"790",11384,"Little Blue Truck board book","Alice Schertle"
"791",11988,"Harry Potter Coloring Book","Scholastic"
"792",12357,"The Day the Crayons Quit","Drew Daywalt"
"793",12328,"Wonder","R. J. Palacio"
"794",11086,"Milk and Honey","Rupi Kaur"
"795",12111,"Giraffes Can't Dance","Giles Andreae"
"796",13846,"The Subtle Art of Not Giving a F*ck: A Counterintuitive Approach to Living a Good Life","Mark Manson"
"797",11579,"The Getaway","Jeff Kinney"
"798",11975,"The Instant Pot Electric Pressure Cooker Cookbook: Easy Recipes for Fast & Healthy Meals","Laurel Randolph"
"799",14878,"Hillbilly Elegy: A Memoir of a Family and Culture in Crisis","J. D. Vance"
"800",14486,"Astrophysics for People in a Hurry","Neil deGrasse Tyson"
"801",14635,"First 100 Words: A Padded Board Book","Roger Priddy"
"802",14631,"The Whole30: The 30-Day Guide to Total Health and Food Freedom","Melissa Hartwig Urban"
"803",13597,"The Handmaid's Tale","Margaret Atwood"
"804",11472,"The 5 Love Languages: The Secret to Love that Lasts","Gary Chapman"
"805",13115,"You Are a Badass: How to Stop Doubting Your Greatness and Start Living an Awesome Life","Jen Sincero"
"806",11904,"What Happened","Hillary Rodham Clinton"
"807",13372,"Oh, the Places You'll Go!","Dr. Seuss"
"808",11006,"Make Your Bed: Little Things That Can Change Your Life...And Maybe the World","Admiral William H. McRaven"
"809",14593,"George Orwell","George Orwell"
"810",11693,"How to Win Friends & Influence People","Dale Carnegie"
"811",12072,"Origin: A Novel (Robert Langdon)","Dan Brown"
"812",14280,"A Man Called Ove: A Novel","Fredrik Backman"
"813",13803,"The Sun and Her Flowers","Rupi Kaur"
"814",14831,"Dear Zoo: A Lift-the-Flap Book","Rod Campbell"
"815",11197,"The Four Agreements: A Practical Guide to Personal Freedom (A Toltec Wisdom Book)","Don Miguel Ruiz"
"816",12634,"The Going-To-Bed Book","Sandra Boynton"
"817",11117,"StrengthsFinder 2.0","Gallup"
"818",14779,"The Wonderful Things You Will Be","Emily Winfield Martin"
"819",13881,"The Shack: Where Tragedy Confronts Eternity","William P. Young"
"820",11355,"The Life-Changing Magic of Tidying Up: The Japanese Art of Decluttering and Organizing","Marie Kondō"
"821",14411,"Option B: Facing Adversity, Building Resilience, and Finding Joy","Sheryl Sandberg"
"822",13310,"Thug Kitchen: The Official Cookbook: Eat Like You Give a F*ck (Thug Kitchen Cookbooks)","Thug Kitchen"
"823",13021,"A Gentleman in Moscow: A Novel","Amor Towles"
"824",13537,"Publication Manual of the American Psychological Association, 6th Edition","American Psychological Association"
"825",13680,"Goodnight Moon","Margaret Wise Brown"
"826",14074,"Thirteen Reasons Why","Jay Asher"
"827",14394,"Leonardo da Vinci","Walter Isaacson"
"828",12106,"The Pout-Pout Fish","Deborah Diesen"
"829",13490,"Harry Potter and the Prisoner of Azkaban: The Illustrated Edition (3)","Mr. Jim Kay"
"830",12565,"If Animals Kissed Good Night","Ann Whitford Paul"
"831",12616,"Brown Bear, Brown Bear, What Do You See?","Bill Martin Jr."
"832",14899,"D&D Player's Handbook (Dungeons & Dragons Core Rulebook)","Dungeons & Dragons"
"833",11611,"The Very Hungry Caterpillar","Eric Carle"
"834",11370,"Puppy Birthday to You! (Paw Patrol) (Little Golden Book)","Golden Books"
"835",11209,"Laugh-Out-Loud Jokes for Kids","Rob Elliott"
"836",11893,"Tools Of Titans: The Tactics, Routines, and Habits of Billionaires, Icons, and World-Class Performers","Timothy Ferriss"
"837",11788,"Milk and Vine: Inspirational Quotes From Classic Vines","Adam Gasiewski"
"838",14518,"Ready Player One: A Novel","Ernest Cline"
"839",14840,"Dog Man: A Tale of Two Kitties: From the Creator of Captain Underpants (Dog Man #3)","Dav Pilkey"
"840",13527,"Obama: An Intimate Portrait","Pete Souza"
"841",14201,"The 7 Habits of Highly Effective People: Powerful Lessons in Personal Change","Stephen R. Covey"
"842",11060,"Killers of the Flower Moon: The Osage Murders and the Birth of the FBI","David Grann"
"843",12129,"The Care and Keeping of You: The Body Book for Younger Girls, Revised Edition (American Girl Library)","Valorie Schaefer"
"844",14030,"Uninvited: Living Loved When You Feel Less Than, Left Out, and Lonely","Lysa TerKeurst"
"845",13479,"Big Little Lies","Liane Moriarty"
"846",14148,"The Official SAT Study Guide","The College Board"
"847",11709,"The Whole30 Cookbook: 150 Delicious and Totally Compliant Recipes to Help You Succeed with the Whole30 and Beyond","Melissa Hartwig Urban"
"848",12706,"Thinking, Fast and Slow","Daniel Kahneman"
"849",11425,"Jesus Calling, Padded Hardcover, with Scripture references","Sarah Young"
"850",12231,"What to Expect When You're Expecting","Heidi Murkoff"
"851",14453,"The Glass Castle: A Memoir (book)","Jeannette Walls"
"852",14768,"The Great Gatsby: The Only Authorized Edition","F. Scott Fitzgerald"
"853",11327,"The Wisdom of Sundays: Life-Changing Insights from Super Soul Conversations","Oprah Winfrey"
"854",14965,"P is for Potty! (Sesame Street) (Lift-the-Flap)","Naomi Kleinberg"
"855",11502,"The Rooster Bar","John Grisham"
"856",14618,"The Giving Tree","Shel Silverstein"
"857",11676,"She Persisted: 13 American Women Who Changed the World","Chelsea Clinton"
"858",11617,"On Tyranny: Twenty Lessons from the Twentieth Century","Timothy Snyder"
"859",12998,"The Alchemist, 25th Anniversary: A Fable About Following Your Dream","Paulo Coelho"
"860",14131,"Fahrenheit 451","Ray Bradbury"
"861",13887,"Camino Island: A Novel","John Grisham"
"862",11346,"Turtles All the Way Down","John Green"
"863",13409,"The Gifts of Imperfection: Let Go of Who You Think You're Supposed to Be and Embrace Who You Are","Brené Brown"
"864",13823,"Love You Forever","Robert Munsch"
"865",13948,"The Pioneer Woman Cooksâ€•Come and Get It!: Simple, Scrumptious Recipes for Crazy Busy Lives","Ree Drummond"
"866",11537,"Mindset: The New Psychology of Success","Carol S. Dweck"
"867",13552,"Where Is Baby's Belly Button? A Lift-the-Flap Book","Karen Katz"
"868",14324,"Grant","Ron Chernow"
"869",14163,NA,NA
"870",14049,"Sapiens: A Brief History of Humankind","Yuval Noah Harari"
"871",11432,"The Intelligent Investor Rev Ed.: The Definitive Book on Value Investing","Benjamin Graham"
"872",14415,"The Plant Paradox: The Hidden Dangers in ""Healthy"" Foods That Cause Disease and Weight Gain (The Plant Paradox, 1)","Dr. Steven R Gundry  MD"
"873",14942,"The Trials of Apollo Book Two The Dark Prophecy (Trials of Apollo, 2)","Rick Riordan"
"874",12954,"Everything, Everything","Nicola Yoon"
"875",13210,"Start with Why: How Great Leaders Inspire Everyone to Take Action","Simon Sinek"
"876",12418,"Norse Mythology","Neil Gaiman"
"877",12170,"Beneath a Scarlet Sky: A Novel","Mark Sullivan"
"878",14904,"Dog Man Unleashed: From the Creator of Captain Underpants (Dog Man #2)","Dav Pilkey"
"879",14949,"Lilac Girls: A Novel (Woolsey-Ferriday)","Martha Hall Kelly"
"880",13741,"Harry Potter and the Sorcerer's Stone: The Illustrated Edition (Harry Potter, Book 1)","J.K. Rowling"
"881",13974,"Magnus Chase and the Gods of Asgard, Book 3 The Ship of the Dead (Magnus Chase and the Gods of Asgard, Book 3) (Magnus Chase and the Gods of Asgard, 3)","Rick Riordan"
"882",14278,"Al Franken, Giant of the Senate","Al Franken"
"883",12236,"Principles: Life and Work","Ray Dalio"
"884",12333,"Daring Greatly: How the Courage to Be Vulnerable Transforms the Way We Live, Love, Parent, and Lead","Brené Brown"
"885",13322,"The Complete Ketogenic Diet for Beginners: Your Essential Guide to Living the Keto Lifestyle","Amy Ramos"
"886",13666,"Pokemon Deluxe Essential Handbook: The Need-to-Know Stats and Facts on Over 700 PokÃ©mon","Scholastic"
"887",11786,"10-Day Green Smoothie Cleanse","JJ Smith"
"888",11772,"The Total Money Makeover: Classic Edition: A Proven Plan for Financial Fitness","Dave Ramsey"
"889",11212,"Dragons Love Tacos","Adam Rubin"
"890",14679,"Harry Potter Paperback Box Set (Books 1-7)","J. K. Rowling"
"891",12379,"Killing England: The Brutal Struggle for American Independence (Bill O'Reilly's Killing Series)","Bill O'Reilly"
"892",13408,"Rosie Revere, Engineer (The Questioneers)","Andrea Beaty"
"893",13446,"Becoming","Michelle Obama"
"894",13617,"Girl, Wash Your Face: Stop Believing the Lies About Who You Are So You Can Become Who You Were Meant to Be","Rachel Hollis"
"895",11727,"The Wonky Donkey","Craig Smith"
"896",11402,"Fire and Fury: Inside the Trump White House","Michael Wolff"
"897",11330,"Fear: Trump in the White House","Bob Woodward"
"898",14261,"Last Week Tonight with John Oliver Presents A Day in the Life of Marlon Bundo (Better Bundo Book, LGBT Childrenâ€™s Book)","Jill Twiss"
"899",13017,"12 Rules for Life: An Antidote to Chaos","Jordan B. Peterson"
"900",11925,"Magnolia Table","Joanna Gaines"
"901",14621,"Whose Boat Is This Boat?: Comments That Don't Help in the Aftermath of a Hurricane","The Staff of The Late Show with Stephen Colbert"
"902",12005,"The Subtle Art of Not Giving a F*ck: A Counterintuitive Approach to Living a Good Life","Mark Manson"
"903",13702,"A Higher Loyalty: Truth, Lies, and Leadership","James Comey"
"904",12737,"The Complete Ketogenic Diet for Beginners: Your Essential Guide to Living the Keto Lifestyle","Amy Ramos"
"905",14285,"Diary of a Wimpy Kid #13: Meltdown","Jeff Kinney"
"906",13592,"The 5 Love Languages: The Secret to Love that Lasts","Gary Chapman"
"907",12587,"First 100 Words: A Padded Board Book","Roger Priddy"
"908",14651,"Dog Man: Lord of the Fleas: From the Creator of Captain Underpants (Dog Man #5)","Dav Pilkey"
"909",14866,"Educated: A Memoir","Tara Westover"
"910",13323,"You Are a Badass: How to Stop Doubting Your Greatness and Start Living an Awesome Life","Jen Sincero"
"911",11633,"The Plant Paradox: The Hidden Dangers in ""Healthy"" Foods That Cause Disease and Weight Gain (The Plant Paradox, 1)","Dr. Steven R Gundry  MD"
"912",12050,"Giraffes Can't Dance","Giles Andreae"
"913",13975,"D&D Player's Handbook (Dungeons & Dragons Core Rulebook)","Dungeons & Dragons"
"914",14119,"Homebody: A Guide to Creating Spaces You Never Want to Leave","Joanna Gaines"
"915",13172,"The Very Hungry Caterpillar","Eric Carle"
"916",14609,"Crazy Rich Asians (Crazy Rich Asians Trilogy)","Kevin Kwan"
"917",14800,"The Hate U Give","Angie Thomas"
"918",11839,"The Instant Pot Electric Pressure Cooker Cookbook: Easy Recipes for Fast & Healthy Meals","Laurel Randolph"
"919",11826,"The Four Agreements: A Practical Guide to Personal Freedom (A Toltec Wisdom Book)","Don Miguel Ruiz"
"920",12196,"The Wonderful Things You Will Be","Emily Winfield Martin"
"921",12574,"P is for Potty! (Sesame Street) (Lift-the-Flap)","Naomi Kleinberg"
"922",12548,"The Pout-Pout Fish","Deborah Diesen"
"923",13196,"Lettering and Modern Calligraphy: A Beginner's Guide: Learn Hand Lettering and Brush Lettering","Paper Peony Press"
"924",11007,"Publication Manual of the American Psychological Association, 6th Edition","American Psychological Association"
"925",13466,"Dear Zoo: A Lift-the-Flap Book","Rod Campbell"
"926",11729,"Oh, the Places You'll Go!","Dr. Seuss"
"927",11499,"Dog Man and Cat Kid: From the Creator of Captain Underpants (Dog Man #4)","Dav Pilkey"
"928",11508,"Goodnight Moon","Margaret Wise Brown"
"929",11901,"Salt, Fat, Acid, Heat: Mastering the Elements of Good Cooking","Samin Nosrat"
"930",11170,"A Wrinkle in Time (Time Quintet)","Madeleine L'Engle"
"931",11560,"How to Win Friends & Influence People","Dale Carnegie"
"932",11441,"Dog Man: Brawl of the Wild: From the Creator of Captain Underpants (Dog Man #6)","Dav Pilkey"
"933",14501,"Instant Pot Pressure Cooker Cookbook: 500 Everyday Recipes for Beginners and Advanced Users. Try Easy and Healthy Instant Pot Recipes.","Jennifer Smith"
"934",12490,"Milk and Honey","Rupi Kaur"
"935",11232,"Little Fires Everywhere","Celeste Ng"
"936",12667,"Kitchen Confidential Updated Edition: Adventures in the Culinary Underbelly (P.S.)","Anthony Bourdain"
"937",11847,"The President Is Missing: A Novel","James Patterson"
"938",14702,"School Zone - Big Preschool Workbook - 320 Pages, Ages 3 to 5, Colors, Shapes, Numbers, Early Math, Alphabet, Pre-Writing, Phonics, Following Directions, and More (School Zone Big Workbook Series)","School Zone"
"939",13627,"The Plant Paradox Cookbook: 100 Delicious Recipes to Help You Lose Weight, Heal Your Gut, and Live Lectin-Free (The Plant Paradox, 2)","Dr. Steven R Gundry  MD"
"940",11626,"Ready Player One: A Novel","Ernest Cline"
"941",12273,"Fahrenheit 451","Ray Bradbury"
"942",12202,"Ship of Fools: How a Selfish Ruling Class Is Bringing America to the Brink of Revolution","Tucker Carlson"
"943",14680,"The Alchemist, 25th Anniversary: A Fable About Following Your Dream","Paulo Coelho"
"944",12062,"Wonder","R. J. Palacio"
"945",12286,"To Kill a Mockingbird","Harper Lee"
"946",12877,"The Whole30: The 30-Day Guide to Total Health and Food Freedom","Melissa Hartwig Urban"
"947",13882,"Everybody Always: Becoming Love in a World Full of Setbacks and Difficult People","Bob Goff"
"948",12009,"Before We Were Yours: A Novel","Lisa Wingate"
"949",11358,"The Reckoning: A Novel","John Grisham"
"950",11733,"Brown Bear, Brown Bear, What Do You See?","Bill Martin Jr."
"951",13004,"Beneath a Scarlet Sky: A Novel","Mark Sullivan"
"952",12906,"What to Expect When You're Expecting","Heidi Murkoff"
"953",14973,"Principles: Life and Work","Ray Dalio"
"954",11171,"Astrophysics for People in a Hurry","Neil deGrasse Tyson"
"955",11001,"Laugh-Out-Loud Jokes for Kids","Rob Elliott"
