"","book_id","title","author"
"956",11058,"Medical Medium Liver Rescue: Answers to Eczema, Psoriasis, Diabetes, Strep, Acne, Gout, Bloating, Gallstones, Adrenal Stress, Fatigue, Fatty Liver, Weight Issues, SIBO & Autoimmune Disease","Anthony William"
"957",12204,"The Official SAT Study Guide","The College Board"
"958",14673,"Calm the F*ck Down: An Irreverent Adult Coloring Book","Sasha O'Hara"
"959",14018,"The Care and Keeping of You: The Body Book for Younger Girls, Revised Edition (American Girl Library)","Valorie Schaefer"
"960",12298,"The Outsider: A Novel","Stephen King"
"961",12149,"Where the Crawdads Sing","Delia Owens"
"962",12921,"D&D Dungeon Master's Guide (Dungeons & Dragons Core Rulebook)","Wizards RPG"
"963",14772,"Sapiens: A Brief History of Humankind","Yuval Harari"
"964",13249,"Love You Forever","Robert Munsch"
"965",11809,"Dragons Love Tacos","Adam Rubin"
"966",14995,"The Woman in the Window: A Novel","A. J. Finn"
"967",13811,"D&D Monster Manual (Dungeons & Dragons Core Rulebook)","Wizards RPG"
"968",11165,"Simply Keto: A Practical Approach to Health & Weight Loss with 100+ Easy Low-Carb Recipes","Suzanne Ryan"
"969",14797,"StrengthsFinder 2.0","Gallup"
"970",14668,"Extreme Ownership: How U.S. Navy SEALs Lead and Win (New Edition)","Jocko Willink"
"971",11530,"The Russia Hoax: The Illicit Scheme to Clear Hillary Clinton and Frame Donald Trump","Gregg Jarrett"
"972",13697,"How to Draw 101 Animals (1)","Dan Green"
"973",14303,"The Sun and Her Flowers","Rupi Kaur"
"974",13757,"The Life-Changing Magic of Tidying Up: The Japanese Art of Decluttering and Organizing","Marie Kondō"
"975",14237,"The Easy 5-Ingredient Ketogenic Diet Cookbook: Low-Carb, High-Fat Recipes for Busy People on the Keto Diet","Jen Fisch"
"976",11987,"Where Do Diggers Sleep at Night? (Where Do...Series)","Brianna Caplan Sayres"
"977",12967,"The 7 Habits of Highly Effective People: Powerful Lessons in Personal Change","Stephen R. Covey"
"978",14034,"Whiskey in a Teacup: What Growing Up in the South Taught Me About Life, Love, and Baking Biscuits","Reese Witherspoon"
"979",12932,"Man's Search for Meaning (OLD EDITION/OUT OF PRINT)","Viktor E. Frankl"
"980",11158,"The Great Alone: A Novel","Kristin Hannah"
"981",12568,"The Total Money Makeover: Classic Edition: A Proven Plan for Financial Fitness","Dave Ramsey"
"982",11074,"Cravings: Hungry for More: A Cookbook","Chrissy Teigen"
"983",11449,"The Handmaid's Tale","Margaret Atwood"
"984",12088,"The Gifts of Imperfection: Let Go of Who You Think You're Supposed to Be and Embrace Who You Are","Brené Brown"
"985",14522,"The Great Gatsby: The Only Authorized Edition","F. Scott Fitzgerald"
"986",13185,"The Body Keeps the Score: Brain, Mind, and Body in the Healing of Trauma","Bessel van der Kolk M.D."
"987",14391,"Gmorning, Gnight!: Little Pep Talks for Me & You","Lin-Manuel Miranda"
"988",14999,"Rich Dad Poor Dad: What the Rich Teach Their Kids About Money That the Poor and Middle Class Do Not!","Robert T. Kiyosaki"
"989",12497,"Make Your Bed: Little Things That Can Change Your Life...And Maybe the World","Admiral William H. McRaven"
"990",14836,"Harry Potter Paperback Box Set (Books 1-7)","J. K. Rowling"
"991",14031,"Xanathar's Guide to Everything (Dungeons & Dragons)","Dungeons & Dragons"
"992",14106,"Where the Crawdads Sing","Delia Owens"
"993",13033,"Becoming","Michelle Obama"
"994",14986,"Educated: A Memoir","Tara Westover"
"995",12234,"Dog Man: For Whom the Ball Rolls: From the Creator of Captain Underpants (Dog Man #7)","Dav Pilkey"
"996",14347,"Girl, Wash Your Face: Stop Believing the Lies About Who You Are So You Can Become Who You Were Meant to Be","Rachel Hollis"
"997",13079,"Dog Man: Fetch-22: From the Creator of Captain Underpants (Dog Man #8)","Dav Pilkey"
"998",11515,"Wrecking Ball (Diary of a Wimpy Kid Book 14)","Jeff Kinney"
"999",11703,"The Wonderful Things You Will Be","Emily Winfield Martin"
"1000",13633,"School Zone - Big Preschool Workbook - 320 Pages, Ages 3 to 5, Colors, Shapes, Numbers, Early Math, Alphabet, Pre-Writing, Phonics, Following Directions, and More (School Zone Big Workbook Series)","School Zone"
"1001",14843,"The 5 Love Languages: The Secret to Love that Lasts","Gary Chapman"
"1002",13679,"Girl, Stop Apologizing: A Shame-Free Plan for Embracing and Achieving Your Goals","Rachel Hollis"
"1003",13432,"The Wonky Donkey","Craig Smith"
"1004",12702,"The Subtle Art of Not Giving a F*ck: A Counterintuitive Approach to Living a Good Life","Mark Manson"
"1005",11474,"Difficult Riddles For Smart Kids: 300 Difficult Riddles And Brain Teasers Families Will Love (Books for Smart Kids)","M Prefontaine"
"1006",14098,"Salt, Fat, Acid, Heat: Mastering the Elements of Good Cooking","Samin Nosrat"
"1007",14739,"The Very Hungry Caterpillar","Eric Carle"
"1008",12159,"What Should Danny Do? (The Power to Choose Series) (The Power to Choose, 1)","Adir Levy"
"1009",11087,"It's Not Supposed to Be This Way: Finding Unexpected Strength When Disappointments Leave You Shattered","Lysa TerKeurst"
"1010",11054,"I Am Confident, Brave & Beautiful: A Coloring Book for Girls","Hopscotch Girls"
"1011",13100,"The Four Agreements: A Practical Guide to Personal Freedom (A Toltec Wisdom Book)","Don Miguel Ruiz"
"1012",11525,"Unfreedom of the Press","Mark R. Levin"
"1013",11890,"Dog Man: Brawl of the Wild: From the Creator of Captain Underpants (Dog Man #6)","Dav Pilkey"
"1014",11389,"Giraffes Can't Dance","Giles Andreae"
"1015",12053,"If Animals Kissed Good Night","Ann Whitford Paul"
"1016",14005,"Oh, the Places You'll Go!","Dr. Seuss"
"1017",14938,"Howard Stern Comes Again","Howard Stern"
"1018",11538,"Guts: A Graphic Novel","Raina Telgemeier"
"1019",14983,"The Life-Changing Magic of Tidying Up: The Japanese Art of Decluttering and Organizing","Marie Kondō"
"1020",11329,"Harry Potter and the Goblet of Fire: The Illustrated Edition (Harry Potter, Book 4) (Illustrated edition) (4)","J. K. Rowling"
"1021",13159,"National Geographic Little Kids First Big Book of Why (National Geographic Little Kids First Big Books)","Amy Shields"
"1022",14827,"Instant Pot Pressure Cooker Cookbook: 500 Everyday Recipes for Beginners and Advanced Users. Try Easy and Healthy Instant Pot Recipes.","Jennifer Smith"
"1023",14823,"The Body Keeps the Score: Brain, Mind, and Body in the Healing of Trauma","Bessel van der Kolk M.D."
"1024",13374,"Good Days Start With Gratitude: A 52 Week Guide To Cultivate An Attitude Of Gratitude: Gratitude Journal","Pretty Simple Press"
"1025",12373,"Goodnight Moon","Margaret Wise Brown"
"1026",12032,"The Complete Ketogenic Diet for Beginners: Your Essential Guide to Living the Keto Lifestyle","Amy Ramos"
"1027",12304,"Unicorn Coloring Book: For Kids Ages 4-8 (US Edition) (Silly Bear Coloring Books)","Silly Bear"
"1028",12685,"Strange Planet (Strange Planet Series)","Nathan W. Pyle"
"1029",11815,"D&D Player's Handbook (Dungeons & Dragons Core Rulebook)","Dungeons & Dragons"
"1030",11824,"The Silent Patient","Alex Michaelides"
"1031",12623,"5,000 Awesome Facts (About Everything!)","National Kids"
"1032",14239,"To Kill a Mockingbird","Harper Lee"
"1033",13637,"You Are a Badass: How to Stop Doubting Your Greatness and Start Living an Awesome Life","Jen Sincero"
"1034",11674,"National Geographic Kids Why?: Over 1,111 Answers to Everything","Crispin Boyer"
"1035",12917,"Can't Hurt Me: Master Your Mind and Defy the Odds","David Goggins"
"1036",12788,"The Guardians: A Novel","John Grisham"
"1037",12250,"P is for Potty! (Sesame Street) (Lift-the-Flap)","Naomi Kleinberg"
"1038",12181,"The Total Money Makeover: Classic Edition: A Proven Plan for Financial Fitness","Dave Ramsey"
"1039",11685,"Brown Bear, Brown Bear, What Do You See?","Bill Martin Jr."
"1040",14765,"The Unofficial Harry Potter Cookbook: From Cauldron Cakes to Knickerbocker Glory--More Than 150 Magical Recipes for Wizards and Non-Wizards Alike (Unofficial Cookbook)","Dinah Bucholz"
"1041",12217,"The Mueller Report","The Washington Post"
"1042",13277,"Zen as F*ck (Zen as F*ck Journals)","Monica Sweeney"
"1043",12826,"Rich Dad Poor Dad: What the Rich Teach Their Kids About Money That the Poor and Middle Class Do Not!","Robert T. Kiyosaki"
"1044",13909,"The Institute: A Novel","Stephen King"
"1045",12507,"The Testaments: The Sequel to The Handmaid's Tale","Margaret Atwood"
"1046",14427,"Super Deluxe Essential Handbook (PokÃ©mon): The Need-to-Know Stats and Facts on Over 800 Characters","Scholastic"
"1047",11690,"Lettering and Modern Calligraphy: A Beginner's Guide: Learn Hand Lettering and Brush Lettering","Paper Peony Press"
"1048",13685,"Carson Dellosa First Words Flash Cards, High Frequency Vocabulary Words and Picture for Preschool and Kindergarten, Sight Word Game for Toddlers Ages 4+ (54 Cards) Cards","Brighter Child"
"1049",12814,"Atomic Habits: An Easy & Proven Way to Build Good Habits & Break Bad Ones","James Clear"
"1050",14776,"Make Your Bed: Little Things That Can Change Your Life...And Maybe the World","Admiral William H. McRaven"
"1051",12294,"The Gifts of Imperfection: Let Go of Who You Think You're Supposed to Be and Embrace Who You Are","Brené Brown"
"1052",13376,"Sapiens: A Brief History of Humankind","Yuval Harari"
"1053",11172,"What to Expect When You're Expecting","Heidi Murkoff"
"1054",13938,"Where the Crawdads Sing","Delia Owens"
"1055",14336,"Daring Greatly: How the Courage to Be Vulnerable Transforms the Way We Live, Love, Parent, and Lead","Brené Brown"
"1056",14070,"The Alchemist, 25th Anniversary: A Fable About Following Your Dream","Paulo Coelho"
"1057",14289,"Publication Manual of the American Psychological Association, 6th Edition","American Psychological Association"
"1058",11726,"The Pout-Pout Fish","Deborah Diesen"
"1059",14040,"Talking to Strangers: What We Should Know about the People We Don't Know","Malcolm Gladwell"
"1060",11653,"Dear Zoo: A Lift-the-Flap Book","Rod Campbell"
"1061",13583,"The Overstory: A Novel","Richard Powers"
"1062",13688,"Fahrenheit 451","Ray Bradbury"
"1063",11014,"StrengthsFinder 2.0","Gallup"
"1064",14652,"12 Rules for Life: An Antidote to Chaos","Jordan B. Peterson"
"1065",14555,"Eleanor Oliphant Is Completely Fine: A Novel","Gail Honeyman"
"1066",11721,"Me: Elton John Official Autobiography","Elton John"
"1067",12595,"The Road Back to You: An Enneagram Journey to Self-Discovery","Ian Morgan Cron"
"1068",11926,"The Tattooist of Auschwitz: A Novel","Heather Morris"
"1069",14420,"People of Walmart Adult Coloring Book: Rolling Back Dignity","Andrew Kipple"
"1070",11407,"The Great Gatsby: The Only Authorized Edition","F. Scott Fitzgerald"
"1071",12024,"The Complete Cookbook for Young Chefs: 100+ Recipes that You'll Love to Cook and Eat","America's Test Kitchen Kids"
"1072",13945,"Blowout: Corrupted Democracy, Rogue State Russia, and the Richest, Most Destructive Industry on Earth","Rachel Maddow"
"1073",11768,"Love You Forever","Robert Munsch"
"1074",14596,"The Easy 5-Ingredient Ketogenic Diet Cookbook: Low-Carb, High-Fat Recipes for Busy People on the Keto Diet","Jen Fisch"
"1075",11831,"The Giving Tree","Shel Silverstein"
"1076",13963,"Dragons Love Tacos","Adam Rubin"
"1077",12888,"How to Win Friends & Influence People","Dale Carnegie"
"1078",13234,"Magnolia Table","Joanna Gaines"
"1079",14763,"The Obesity Code - Unlocking the Secrets of Weight Loss (Book 1)","Dr. Jason Fung"
"1080",12354,"Magic Tree House Boxed Set, Books 1-4: Dinosaurs Before Dark, The Knight at Dawn, Mummies in the Morning, and Pirates Past Noon","Mary Pope Osborne"
"1081",12885,"Then She Was Gone: A Novel","Lisa Jewell"
"1082",11262,"The Pioneers: The Heroic Story of the Settlers Who Brought the American Ideal West","David McCullough"
"1083",13876,"Wacky Waving Inflatable Tube Guy (RP Minis)","Conor Riordan"
"1084",11380,"Medical Medium Liver Rescue: Answers to Eczema, Psoriasis, Diabetes, Strep, Acne, Gout, Bloating, Gallstones, Adrenal Stress, Fatigue, Fatty Liver, Weight Issues, SIBO & Autoimmune Disease","Anthony William"
"1085",12154,"The Care and Keeping of You: The Body Book for Younger Girls, Revised Edition (American Girl Library)","Valorie Schaefer"
"1086",14881,"There's No Place Like Space: All About Our Solar System (Cat in the Hat's Learning Library)","Tish Rabe"
"1087",11109,"How to Draw 101 Animals (1)","Dan Green"
"1088",11875,NA,NA
"1089",14714,"Simply Keto: A Practical Approach to Health & Weight Loss with 100+ Easy Low-Carb Recipes","Suzanne Ryan"
"1090",14405,"The Outsiders","S. E. Hinton"
"1091",12188,"The Try Not to Laugh Challenge - Would Your Rather? - EWW Edition","Crazy Corey"
"1092",11559,"A Promised Land","Barack Obama"
"1093",12022,"Too Much and Never Enough: How My Family Created the World's Most Dangerous Man","Mary L. Trump Ph.D."
"1094",12026,"Where the Crawdads Sing","Delia Owens"
"1095",14306,"My First Learn-to-Write Workbook: Practice for Kids with Pen Control, Line Tracing, Letters, and More!","Crystal Radke"
"1096",13146,"Midnight Sun","Stephenie Meyer"
"1097",14617,"Untamed","Glennon Doyle"
"1098",12501,"If Animals Kissed Good Night","Ann Whitford Paul"
"1099",14919,"White Fragility: Why It's So Hard for White People to Talk About Racism","Dr. Robin DiAngelo"
"1100",14533,"School Zone - Big Preschool Workbook - 320 Pages, Ages 3 to 5, Colors, Shapes, Numbers, Early Math, Alphabet, Pre-Writing, Phonics, Following Directions, and More (School Zone Big Workbook Series)","School Zone"
"1101",14408,"The Room Where It Happened: A White House Memoir","John Bolton"
"1102",12666,"The Ballad of Songbirds and Snakes (A Hunger Games Novel)","Suzanne Collins"
"1103",13313,"Dog Man: Grime and Punishment: A Graphic Novel (Dog Man #9): From the Creator of Captain Underpants (9)","Dav Pilkey"
"1104",12866,"The Very Hungry Caterpillar","Eric Carle"
"1105",14020,"Becoming","Michelle Obama"
"1106",14890,"How to Be an Antiracist","Ibram X. Kendi"
"1107",13094,"The Four Agreements: A Practical Guide to Personal Freedom (A Toltec Wisdom Book)","Don Miguel Ruiz"
"1108",14036,"Rage","Bob Woodward"
"1109",11898,"Caste (Oprah's Book Club): The Origins of Our Discontents","Isabel Wilkerson"
"1110",11497,"Greenlights","Matthew McConaughey"
"1111",11775,"I Am Confident, Brave & Beautiful: A Coloring Book for Girls","Hopscotch Girls"
"1112",14267,"American Dirt (Oprah's Book Club): A Novel","Jeanine Cummins"
"1113",12386,"The Boy, the Mole, the Fox and the Horse","Charlie Mackesy"
"1114",13242,"Little Fires Everywhere: A Novel","Celeste Ng"
"1115",11491,"The Deep End (Diary of a Wimpy Kid Book 15)","Jeff Kinney"
"1116",11155,"Atomic Habits: An Easy & Proven Way to Build Good Habits & Break Bad Ones","James Clear"
"1117",14994,"I Love You to the Moon and Back","Amelia Hepworth"
"1118",12416,"How to Catch a Mermaid","Adam Wallace"
"1119",11867,"The Splendid and the Vile: A Saga of Churchill, Family, and Defiance During the Blitz","Erik Larson"
"1120",13875,"How to Catch a Unicorn","Adam Wallace"
"1121",14195,"Giraffes Can't Dance","Giles Andreae"
"1122",14655,"Brown Bear, Brown Bear, What Do You See?","Bill Martin Jr."
"1123",11369,"The 5 Love Languages: The Secret to Love that Lasts","Gary Chapman"
"1124",13088,"Magnolia Table, Volume 2: A Collection of Recipes for Gathering","Joanna Gaines"
"1125",12741,"The Vanishing Half: A Novel","Brit Bennett"
"1126",14374,"Modern Comfort Food: A Barefoot Contessa Cookbook","Ina Garten"
"1127",14128,"Prayer Journal for Women: 52 Week Scripture, Devotional & Guided Prayer Journal","Shannon Roberts"
"1128",13295,"The Wonky Donkey","Craig Smith"
"1129",13184,"The Body Keeps the Score: Brain, Mind, and Body in the Healing of Trauma","Bessel van der Kolk M.D."
"1130",12070,"Paint by Sticker Kids: Zoo Animals: Create 10 Pictures One Sticker at a Time!","Workman Publishing"
"1131",13787,"Paint by Sticker Kids: Unicorns & Magic: Create 10 Pictures One Sticker at a Time! Includes Glitter Stickers","Workman Publishing"
"1132",13900,"What Should Danny Do? (The Power to Choose Series) (The Power to Choose, 1)","Adir Levy"
"1133",11949,"Wacky Waving Inflatable Tube Guy (RP Minis)","Conor Riordan"
"1134",12682,"The Silent Patient","Alex Michaelides"
"1135",12865,"The Big Book of Silly Jokes for Kids","Carole P. Roman"
"1136",13678,"Chicka Chicka Boom Boom (Board Book)","Bill Martin Jr."
"1137",12030,"Live Free Or Die: America (and the World) on the Brink","Sean Hannity"
"1138",13153,"Burn After Writing","Sharon Jones"
"1139",14803,"Get Out of Your Head: Stopping the Spiral of Toxic Thoughts","Jennie Allen"
"1140",11221,"Human Body Activity Book for Kids: Hands-On Fun for Grades K-3","Ph.D., Katie Stokes, M.Ed.,"
"1141",12522,"Educated: A Memoir","Tara Westover"
"1142",11263,"Then She Was Gone: A Novel","Lisa Jewell"
"1143",11241,"Difficult Riddles For Smart Kids: 300 Difficult Riddles And Brain Teasers Families Will Love (Books for Smart Kids)","M Prefontaine"
"1144",11564,"1984","George Orwell"
"1145",13459,"Humans","Brandon Stanton"
"1146",14409,"Goodnight Moon","Margaret Wise Brown"
"1147",11942,"I've Loved You Since Forever","Hoda Kotb"
"1148",13585,"Just Mercy: A Story of Justice and Redemption","Bryan Stevenson"
"1149",14581,"Rich Dad Poor Dad: What the Rich Teach Their Kids About Money That the Poor and Middle Class Do Not!","Robert T. Kiyosaki"
"1150",11051,"The Complete Cookbook for Young Chefs: 100+ Recipes that You'll Love to Cook and Eat","America's Test Kitchen Kids"
"1151",11042,"Publication Manual (OFFICIAL) 7th Edition of the American Psychological Association","American Psychological Association"
"1152",13190,"First Little Readers Parent Pack: Guided Reading Level A: 25 Irresistible Books That Are Just the Right Level for Beginning Readers","Deborah Schecter"
"1153",14725,"The Mamba Mentality: How I Play","Kobe Bryant"
"1154",13026,"School Zone - Multiplication 0-12 Flash Cards - Ages 8+, 3rd Grade, 4th Grade, Elementary Math, Multiplication Facts, Common Core, and More","School Zone"
"1155",12437,"There's No Place Like Space: All About Our Solar System (Cat in the Hat's Learning Library)","Tish Rabe"
"1156",13593,"Disloyal: A Memoir: The True Story of the Former Personal Attorney to President Donald J. Trump","Michael Cohen"
"1157",14589,"My First Toddler Coloring Book: Fun with Numbers, Letters, Shapes, Colors, and Animals! (Kids coloring activity books)","Tanya Emelyanova"
"1158",12605,"The Alchemist, 25th Anniversary: A Fable About Following Your Dream","Paulo Coelho"
"1159",13413,"To Kill a Mockingbird","Harper Lee"
"1160",13377,"Percy Jackson and the Olympians 5 Book Paperback Boxed Set (w/poster) (Percy Jackson & the Olympians)","Rick Riordan"
"1161",11482,"Magnolia Table","Joanna Gaines"
"1162",12563,"Llama Llama Loves Camping","Anna Dewdney"
"1163",14672,"So You Want to Talk About Race","Ijeoma Oluo"
"1164",12555,"Blackout: How Black America Can Make Its Second Escape from the Democrat Plantation","Candace Owens"
"1165",12681,"How to Draw 101 Animals (1)","Dan Green"
"1166",12578,"Awesome Science Experiments for Kids: 100+ Fun STEM / STEAM Projects and Why They Work (Awesome STEAM Activities for Kids)","Crystal Chatterton"
"1167",14945,"The Unofficial Harry Potter Cookbook: From Cauldron Cakes to Knickerbocker Glory--More Than 150 Magical Recipes for Wizards and Non-Wizards Alike (Unofficial Cookbook)","Dinah Bucholz"
"1168",12689,"A Time for Mercy (Jake Brigance)","John Grisham"
"1169",12895,"Oh, the Places You'll Go!","Dr. Seuss"
"1170",12066,"Good Days Start With Gratitude: A 52 Week Guide To Cultivate An Attitude Of Gratitude: Gratitude Journal","Pretty Simple Press"
"1171",14947,"Dog Man: Fetch-22: From the Creator of Captain Underpants (Dog Man #8)","Dav Pilkey"
"1172",13160,"The Pout-Pout Fish","Deborah Diesen"
"1173",12558,"Where's Spot?","Eric Hill"
"1174",13354,"Salt, Fat, Acid, Heat: Mastering the Elements of Good Cooking","Samin Nosrat"
"1175",11631,"Man's Search for Meaning","Viktor E. Frankl"
"1176",13857,"Ready Player Two: A Novel","Ernest Cline"
"1177",14760,"Preschool Math Workbook for Toddlers Ages 2-4: Beginner Math Preschool Learning Book with Number Tracing and Matching Activities for 2, 3 and 4 year olds and kindergarten prep","Modern Kid Press"
"1178",12850,"Stamped from the Beginning: The Definitive History of Racist Ideas in America (National Book Award Winner)","Ibram X. Kendi"
"1179",12875,"Let That Sh*t Go: A Journal for Leaving Your Bullsh*t Behind and Creating a Happy Life (Zen as F*ck Journals)","Monica Sweeney"
"1180",12936,"The Intelligent Investor Rev Ed.: The Definitive Book on Value Investing","Benjamin Graham"
"1181",14341,"The Wonderful Things You Will Be","Emily Winfield Martin"
"1182",11032,"Carson Dellosa First Words Flash Cards, High Frequency Vocabulary Words and Picture for Preschool and Kindergarten, Sight Word Game for Toddlers Ages 4+ (54 Cards) Cards","Brighter Child"
"1183",12909,"The Subtle Art of Not Giving a F*ck: A Counterintuitive Approach to Living a Good Life","Mark Manson"
"1184",12585,"Love You Forever","Robert Munsch"
"1185",11620,"Magic Tree House Boxed Set, Books 1-4: Dinosaurs Before Dark, The Knight at Dawn, Mummies in the Morning, and Pirates Past Noon","Mary Pope Osborne"
"1186",13695,"Zen as F*ck (Zen as F*ck Journals)","Monica Sweeney"
"1187",12534,"Relationship Goals: How to Win at Dating, Marriage, and Sex","Michael Todd"
"1188",11782,"The Happy in a Hurry Cookbook: 100-Plus Fast and Easy New Recipes That Taste Like Home (The Happy Cookbook Series)","Steve Doocy"
"1189",12841,"Learn to Read: A Magical Sight Words and Phonics Activity Workbook for Beginning Readers Ages 5-7: Reading Made Easy | Preschool, Kindergarten and 1st Grade","Modern Kid Press"
"1190",13795,"P is for Potty! (Sesame Street) (Lift-the-Flap)","Naomi Kleinberg"
"1191",12711,"D&D Player's Handbook (Dungeons & Dragons Core Rulebook)","Dungeons & Dragons"
"1192",11850,"Atomic Habits: An Easy & Proven Way to Build Good Habits & Break Bad Ones","James Clear"
"1193",11279,"American Marxism","Mark R. Levin"
"1194",12124,"The Four Agreements: A Practical Guide to Personal Freedom (A Toltec Wisdom Book)","Don Miguel Ruiz"
"1195",14613,"If Animals Kissed Good Night","Ann Whitford Paul"
"1196",11992,"The Body Keeps the Score: Brain, Mind, and Body in the Healing of Trauma","Bessel van der Kolk M.D."
"1197",11362,"I Love You to the Moon and Back","Amelia Hepworth"
"1198",11481,"It Ends with Us: A Novel (1)","Colleen Hoover"
"1199",12277,"The Boy, the Mole, the Fox and the Horse","Charlie Mackesy"
"1200",12203,"The Very Hungry Caterpillar","Eric Carle"
"1201",13052,"My First Learn-to-Write Workbook: Practice for Kids with Pen Control, Line Tracing, Letters, and More!","Crystal Radke"
"1202",12099,"The Midnight Library: A Novel","Matt Haig"
"1203",12675,"The Four Winds: A Novel","Kristin Hannah"
"1204",13337,"Dog Man: Mothering Heights: A Graphic Novel (Dog Man #10): From the Creator of Captain Underpants (10)","Dav Pilkey"
"1205",12058,"The Last Thing He Told Me: A Novel","Laura Dave"
"1206",13049,"Big Shot Diary of a Wimpy Kid Book 16","Jeff Kinney"
"1207",13973,"The Real Anthony Fauci: Bill Gates, Big Pharma, and the Global War on Democracy and Public Health (Childrenâ€™s Health Defense)","Robert F. Kennedy Jr."
"1208",13204,"The Seven Husbands of Evelyn Hugo: A Novel","Taylor Jenkins Reid"
"1209",12388,"The 48 Laws of Power","Robert Greene"
"1210",14742,"Oh, the Places You'll Go!Â Â ","Dr. Seuss"
"1211",11872,"Brown Bear, Brown Bear, What Do You See?","Bill Martin Jr."
"1212",12838,"Rich Dad Poor Dad: What the Rich Teach Their Kids About Money That the Poor and Middle Class Do Not!","Robert T. Kiyosaki"
"1213",11642,"The 5 Love Languages: The Secret to Love that Lasts","Gary Chapman"
"1214",12163,"Burn After Writing (Pink)","Sharon Jones"
"1215",11651,"1984","George Orwell"
"1216",12487,"Peril","Bob Woodward"
"1217",14558,"Untamed","Glennon Doyle"
"1218",14173,"Dune (Dune Chronicles, Book 1)","Frank Herbert"
"1219",14588,"My First Library : Boxset of 10 Board Books for Kids","Wonder House Books"
"1220",13429,"Atlas of the Heart: Mapping Meaningful Connection and the Language of Human Experience","Brené Brown"
"1221",13999,"The Song of Achilles: A Novel","Madeline Miller"
"1222",12796,"The Hill We Climb: An Inaugural Poem for the Country","Amanda Gorman"
"1223",12491,"Greenlights","Matthew McConaughey"
"1224",14369,"Crystals for Beginners: The Guide to Get Started with the Healing Power of Crystals","Karen Frazier"
"1225",13177,"The Storyteller: Tales of Life and Music","Dave Grohl"
"1226",13327,"The Alchemist, 25th Anniversary: A Fable About Following Your Dream","Paulo Coelho"
"1227",12773,"School Zone - Big Preschool Workbook - 320 Pages, Ages 3 to 5, Colors, Shapes, Numbers, Early Math, Alphabet, Pre-Writing, Phonics, Following Directions, and More (School Zone Big Workbook Series)","School Zone"
"1228",11773,"I Am Confident, Brave & Beautiful: A Coloring Book for Girls","Hopscotch Girls"
"1229",12268,"The Subtle Art of Not Giving a F*ck: A Counterintuitive Approach to Living a Good Life","Mark Manson"
"1230",11112,"They Both Die at the End","Adam Silvera"
"1231",13873,"Caste (Oprah's Book Club): The Origins of Our Discontents","Isabel Wilkerson"
"1232",12823,"How to Catch a Mermaid","Adam Wallace"
"1233",14576,"Call Us What We Carry: Poems","Amanda Gorman"
"1234",11544,"We Were Liars","E. Lockhart"
"1235",12341,"Go Tell the Bees That I Am Gone: A Novel (Outlander)","Diana Gabaldon"
"1236",13300,"Grumpy Monkey","Suzanne Lang"
"1237",12611,"Self-Love Workbook for Women: Release Self-Doubt, Build Self-Compassion, and Embrace Who You Are (Self-Help Workbooks for Women)","Megan Logan MSW  LCSW"
"1238",12081,"Publication Manual (OFFICIAL) 7th Edition of the American Psychological Association","American Psychological Association"
"1239",12390,"Paint by Sticker Kids: Zoo Animals: Create 10 Pictures One Sticker at a Time!","Workman Publishing"
"1240",12358,"How to Win Friends & Influence People","Dale Carnegie"
"1241",12976,"The Wonderful Things You Will Be","Emily Winfield Martin"
