"","book_id","title","author"
"328",11026,"The Blood Sugar Solution: The UltraHealthy Program for Losing Weight, Preventing Disease, and Feeling Great Now!","Mark Hyman M.D."
"329",12855,"Goodnight, Goodnight Construction Site (Hardcover Books for Toddlers, Preschool Books for Kids)","Sherri Duskey Rinker"
"330",11828,"The Immortal Life of Henrietta Lacks","Rebecca Skloot"
"331",12161,"The Fault in Our Stars","John Green"
"332",13008,"The Serpent's Shadow (The Kane Chronicles, Book 3)","Rick Riordan"
"333",11018,"One Thousand Gifts: A Dare to Live Fully Right Where You Are","Ann Voskamp"
"334",13319,"Wild: From Lost to Found on the Pacific Crest Trail","Cheryl Strayed"
"335",12077,"Winter of the World: Book Two of the Century Trilogy","Ken Follett"
"336",13451,"The Pioneer Woman Cooks: Food from My Frontier","Ree Drummond"
"337",13950,"The Lego Ideas Book: Unlock Your Imagination","Daniel Lipkowitz"
"338",13353,"Heaven is for Real: A Little Boy's Astounding Story of His Trip to Heaven and Back","Todd Burpo"
"339",14790,"Jesus Calling, Padded Hardcover, with Scripture references","Sarah Young"
"340",14701,"Eat to Live: The Amazing Nutrient-Rich Program for Fast and Sustained Weight Loss, Revised Edition","Joel Fuhrman MD"
"341",11480,"Thomas Jefferson: The Art of Power","Jon Meacham"
"342",11356,"Good to Great: Why Some Companies Make the Leap and Others Don't","Jim Collins"
"343",14483,"The Amateur","Edward Klein"
"344",14715,"The Smitten Kitchen Cookbook: Recipes and Wisdom from an Obsessive Home Cook","Deb Perelman"
"345",14290,"What to Expect When You're Expecting","Heidi Murkoff"
"346",14703,"The Walking Dead: Compendium One","Robert Kirkman"
"347",12495,"The Signal and the Noise: Why So Many Predictions Fail-But Some Don't","Nate Silver"
"348",13332,"How to Tell If Your Cat Is Plotting to Kill You (The Oatmeal) (Volume 2)","The Oatmeal"
"349",13985,"A Dance with Dragons (A Song of Ice and Fire)","George R. R. Martin"
"350",11447,"America Again: Re-becoming the Greatness We Never Weren't","Stephen Colbert"
"351",11192,"LEGO NINJAGO: Character Encyclopedia","DK Publishing"
"352",11059,"American Sniper: The Autobiography of the Most Lethal Sniper in U.S. Military History","Chris Kyle"
"353",14875,"Outliers: The Story of Success","Malcolm Gladwell"
"354",14578,"Teach Like a Champion: 49 Techniques that Put Students on the Path to College","Doug Lemov"
"355",14630,"Bared to You","Sylvia Day"
"356",14567,"The Four Agreements: A Practical Guide to Personal Freedom (A Toltec Wisdom Book)","Don Miguel Ruiz"
"357",13768,"Strengths Based Leadership: Great Leaders, Teams, and Why People Follow","Tom Rath"
"358",13110,"The 17 Day Diet: A Doctor's Plan Designed for Rapid Results","Mike Moreno"
"359",13613,"Crazy Love: Overwhelmed by a Relentless God","Francis Chan"
"360",12922,"Go the F**k to Sleep","Adam Mansbach"
"361",12942,"Bring Up the Bodies","Hilary Mantel"
"362",13335,"Great by Choice: Uncertainty, Chaos, and Luck--Why Some Thrive Despite Them All (Good to Great, 5)","Jim Collins"
"363",12439,"Eat to Live: The Amazing Nutrient-Rich Program for Fast and Sustained Weight Loss","Joel Fuhrman MD"
"364",14051,"Reflected in You (Crossfire, Book 2)","Sylvia Day"
"365",13054,"Who Moved My Cheese","Spencer Johnson"
"366",14209,"The Book Thief","Markus Zusak"
"367",12089,"A Guide to the Project Management Body of Knowledge","Project Management Institute"
"368",13872,"Behind the Beautiful Forevers: Life, Death, and Hope in a Mumbai Undercity","Katherine Boo"
"369",11287,"Deadlocked (Sookie Stackhouse/True Blood, Book 12)","Charlaine Harris"
"370",12913,"Crucial Conversations Tools for Talking When Stakes Are High, Second Edition","Kerry Patterson"
"371",12813,"Forks Over Knives: The Plant-Based Way to Health. The #1 New York Times Bestseller","Gene Stone"
"372",14455,"The Jesus Storybook Bible: Every Story Whispers His Name","Sally Lloyd-Jones"
"373",11131,"Notorious Nineteen: A Stephanie Plum Novel","Janet Evanovich"
"374",11140,"The 4-Hour Chef: The Simple Path to Cooking Like a Pro, Learning Anything, and Living the Good Life","Timothy Ferriss"
"375",14151,"Cloud Atlas","David Mitchell"
"376",13442,"The Alchemist","Paulo Coelho"
"377",13676,"The Hunger Games","Suzanne Collins"
"378",11436,"Help, Thanks, Wow: The Three Essential Prayers","Anne Lamott"
"379",13732,"Wonder","R. J. Palacio"
"380",12576,"Stop Living In This Land, Go To The Everlasting World Of Happiness, Live There Forever","Woo Myung"
"381",13715,"To Heaven and Back: A Doctor's Extraordinary Account of Her Death, Heaven, Angels, and Life Again: A True Story","Mary C. Neal"
"382",12830,"Forks Over Knives: The Cookbook. A New York Times Bestseller: Over 300 Simple and Delicious Plant-Based Recipes to Help You Lose Weight, Be Healthier, and Feel Better Every Day","Del Sroufe"
"383",13852,"Catching Fire (Hunger Games)","Suzanne Collins"
"384",13261,"A Memory of Light (Wheel of Time, Book 14) (Wheel of Time, 14)","Robert Jordan"
"385",13804,"Cabin Fever (Diary of a Wimpy Kid, Book 6)","Jeff Kinney"
"386",13402,"The 7 Habits of Highly Effective Teens: The Ultimate Teenage Success Guide","Sean Covey"
"387",12981,"The Passage of Power: The Years of Lyndon Johnson","Robert A. Caro"
"388",14640,"The Pioneer Woman Cooks: Recipes from an Accidental Country Girl","Ree Drummond"
"389",11270,"Divine Healing Hands: Experience Divine Power to Heal You, Animals, and Nature, and to Transform All Life (Soul Power)","Zhi Gang Sha Dr."
"390",13144,"The China Study: The Most Comprehensive Study of Nutrition Ever Conducted And the Startling Implications for Diet, Weight Loss, And Long-term Health","Thomas Campbell"
"391",13966,NA,NA
"392",11565,"The Meaning of Marriage: Facing the Complexities of Commitment with the Wisdom of God","Timothy Keller"
"393",12884,"Night (Night)","Elie Wiesel"
"394",14429,"StrengthsFinder 2.0","Gallup"
"395",13266,"Lean In: Women, Work, and the Will to Lead","Sheryl Sandberg"
"396",11816,"Diary of a Wimpy Kid: Hard Luck, Book 8","Jeff Kinney"
"397",12345,"Rush Revere and the Brave Pilgrims: Time-Travel Adventures with Exceptional Americans (1)","Rush Limbaugh"
"398",13404,"Jesus Calling, Padded Hardcover, with Scripture references","Sarah Young"
"399",13923,"Inferno","Dan Brown"
"400",14354,"The House of Hades (Heroes of Olympus, Book 4)","Rick Riordan"
"401",13055,"Things That Matter: Three Decades of Passions, Pastimes and Politics [Deckled Edge]","Charles Krauthammer"
"402",13590,"The Great Gatsby: The Only Authorized Edition","F. Scott Fitzgerald"
"403",14366,"Killing Jesus (Bill O'Reilly's Killing Series)","Bill O'Reilly"
"404",12033,"Proof of Heaven: A Neurosurgeon's Journey into the Afterlife","Eben Alexander"
"405",12622,"Diagnostic and Statistical Manual of Mental Disorders, 5th Edition: DSM-5","American Psychiatric Association"
"406",14276,"The Official SAT Study Guide","The College Board"
"407",12766,"The Fault in Our Stars","John Green"
"408",11151,"The Book Thief","Markus Zusak"
"409",13029,"Wonder","R. J. Palacio"
"410",13640,"The 5 Love Languages: The Secret to Love That Lasts","Gary Chapman"
"411",12367,"Publication Manual of the American Psychological Association, 6th Edition","American Psychological Association"
"412",13171,"Divergent","Veronica Roth"
"413",12599,"Laugh-Out-Loud Jokes for Kids","Rob Elliott"
"414",13739,"Oh, the Places You'll Go!Â Â ","Dr. Seuss"
"415",11393,"David and Goliath: Underdogs, Misfits, and the Art of Battling Giants","Malcolm Gladwell"
"416",12307,"Game of Thrones Boxed Set: A Game of Thrones/A Clash of Kings/A Storm of Swords/A Feast for Crows","George R.R. Martin"
"417",14351,"Allegiant","Veronica Roth"
"418",14946,"And the Mountains Echoed","Khaled Hosseini"
"419",12643,"Humans of New York","Brandon Stanton"
"420",14259,"The Legend of Zelda: Hyrule Historia","Patrick Thorpe"
"421",11179,"Doctor Sleep: A Novel","Stephen King"
"422",11177,"Knock-Knock Jokes for Kids (Laugh-Out-Loud Jokes for Kids)","Rob Elliott"
"423",13699,"The Goldfinch: A Novel (Pulitzer Prize for Fiction)","Donna Tartt"
"424",12251,"The Four Agreements: A Practical Guide to Personal Freedom (A Toltec Wisdom Book)","Don Miguel Ruiz"
"425",12430,"Gone Girl","Gillian Flynn"
"426",14526,"George Washington's Secret Six: The Spy Ring That Saved the American Revolution","Brian Kilmeade"
"427",11657,"Quiet: The Power of Introverts in a World That Can't Stop Talking","Susan Cain"
"428",14162,"Goodnight, Goodnight Construction Site (Hardcover Books for Toddlers, Preschool Books for Kids)","Sherri Duskey Rinker"
"429",14235,"Sycamore Row (Jake Brigance)","John Grisham"
"430",12718,"Wheat Belly: Lose the Wheat, Lose the Weight, and Find Your Path Back to Health","William Davis"
"431",14144,"The Pioneer Woman Cooksâ€•A Year of Holidays: 140 Step-by-Step Recipes for Simple, Scrumptious Celebrations","Ree Drummond"
"432",14363,"The Day the Crayons Quit","Drew Daywalt"
"433",11132,"Happy, Happy, Happy: My Life and Legacy as the Duck Commander","Phil Robertson"
"434",14587,"The Very Hungry Caterpillar","Eric Carle"
"435",11751,"Daring Greatly: How the Courage to Be Vulnerable Transforms the Way We Live, Love, Parent, and Lead","Brené Brown"
"436",14606,"The 7 Habits of Highly Effective People: Powerful Lessons in Personal Change","Stephen R. Covey"
"437",14944,"Joyland (Hard Case Crime)","Stephen King"
"438",14491,"Fifty Shades Of Grey: Book One of the Fifty Shades Trilogy (Fifty Shades Of Grey Series, 1)","E L James"
"439",11371,"Soul Healing Miracles: Ancient and New Sacred Wisdom, Knowledge, and Practical Techniques for Healing the Spiritual, Mental, Emotional, and Physical Bodies","Zhi Gang Sha"
"440",13808,"Shred: The Revolutionary Diet: 6 Weeks 4 Inches 2 Sizes","Ian K. Smith M.D."
"441",11664,"Hyperbole and a Half: Unfortunate Situations, Flawed Coping Mechanisms, Mayhem, and Other Things That Happened","Allie Brosh"
"442",11836,"To Kill a Mockingbird","Harper Lee"
"443",14690,"The Five Dysfunctions of a Team: A Leadership Fable, 20th Anniversary Edition","Patrick Lencioni"
"444",11435,"Unbroken: A World War II Story of Survival, Resilience, and Redemption","Laura Hillenbrand"
"445",13126,"Ender's Game (The Ender Quintet)","Orson Scott Card"
"446",14569,"The Gifts of Imperfection: Let Go of Who You Think You're Supposed to Be and Embrace Who You Are","Brené Brown"
"447",11912,"The Cuckoo's Calling (A Cormoran Strike Novel, 1)","Robert Galbraith"
"448",13612,"What to Expect When You're Expecting","Heidi Murkoff"
"449",11744,"America the Beautiful: Rediscovering What Made This Nation Great","Ben Carson  M.D."
"450",14928,"The Liberty Amendments: Restoring the American Republic","Mark R. Levin"
"451",14736,"ZEALOT: The Life and Times of Jesus of Nazareth","Reza Aslan"
"452",11692,"The One and Only Ivan","Katherine Applegate"
"453",13850,"Good to Great: Why Some Companies Make the Leap and Others Don't","Jim Collins"
"454",11427,"SI-COLOGY 1: Tales and Wisdom from Duck Dynasty's Favorite Uncle","Si Robertson"
"455",14464,"IT'S ALL GOOD: Delicious, Easy Recipes That Will Make You Look Good and Feel Great","Gwyneth Paltrow"
"456",11204,"Outliers: The Story of Success","Malcolm Gladwell"
"457",11222,"Jerusalem: A Cookbook","Yotam Ottolenghi"
"458",14186,"Becoming a Supple Leopard: Movement, Mobility, and Maintenance of the Human Animal","Kelly Starrett"
"459",11125,"Grain Brain: The Surprising Truth about Wheat, Carbs, and Sugar--Your Brain's Silent Killers","David Perlmutter MD"
"460",14050,"Looking for Alaska","John Green"
"461",13726,"I Am Malala: The Girl Who Stood Up for Education and Was Shot by the Taliban","Malala Yousafzai"
"462",13477,"Love You Forever","Robert Munsch"
"463",11885,"The Perks of Being a Wallflower","Stephen Chbosky"
"464",11855,"Practical Paleo: A Customized Approach to Health and a Whole-Foods Lifestyle","Diane Sanfilippo"
"465",11444,"Fifty Shades Trilogy (Fifty Shades of Grey / Fifty Shades Darker / Fifty Shades Freed)","E L James"
"466",12347,"The FastDiet: Lose Weight, Stay Healthy, and Live Longer with the Simple Secret of Intermittent Fasting","Dr Dr Michael Mosley"
"467",12502,"The Jesus Storybook Bible: Every Story Whispers His Name","Sally Lloyd-Jones"
"468",12756,"Divergent / Insurgent","Veronica Roth"
"469",11273,"How to Win Friends & Influence People","Dale Carnegie"
"470",13426,"The Bully Pulpit: Theodore Roosevelt, William Howard Taft, and the Golden Age of Journalism","Doris Kearns Goodwin"
"471",11691,"The Hunger Games (Book 1)","Suzanne Collins"
"472",11795,"ObamaCare Survival Guide: The Affordable Care Act and What It Means for You and Your Healthcare","Nick J. Tate"
"473",11191,"The Harbinger: The Ancient Mystery that Holds the Secret of America's Future","Jonathan Cahn"
"474",11787,"The Immortal Life of Henrietta Lacks","Rebecca Skloot"
"475",13086,"Night (Night)","Elie Wiesel"
"476",12901,"Fifty Shades Darker","E L James"
"477",13186,"Eat to Live: The Amazing Nutrient-Rich Program for Fast and Sustained Weight Loss, Revised Edition","Joel Fuhrman MD"
"478",13183,"Forks Over Knives: The Cookbook. A New York Times Bestseller: Over 300 Simple and Delicious Plant-Based Recipes to Help You Lose Weight, Be Healthier, and Feel Better Every Day","Del Sroufe"
"479",13645,"Fifty Shades Freed: Book Three of the Fifty Shades Trilogy (Fifty Shades of Grey Series) (English Edition) (Fifty Shades Of Grey Series, 3)","E L James"
"480",11613,"The Alchemist","Paulo Coelho"
"481",13248,"The Catcher in the Rye","J.D. Salinger"
"482",13799,"Mindset: The New Psychology of Success","Carol S. Dweck"
"483",14754,"Wheat Belly Cookbook: 150 Recipes to Help You Lose the Wheat, Lose the Weight, and Find Your Path Back to Health","William Davis"
"484",12533,"MyMathLab: Student Access Kit","Hall H Pearson Education"
"485",12698,"The Care and Keeping of You: The Body Book for Younger Girls, Revised Edition (American Girl Library)","Valorie Schaefer"
"486",11149,"The Power of Habit: Why We Do What We Do in Life and Business","Charles Duhigg"
"487",12001,"The Reason I Jump: The Inner Voice of a Thirteen-Year-Old Boy with Autism","Naoki Higashida"
"488",13056,"Strengths Based Leadership: Great Leaders, Teams, and Why People Follow","Tom Rath"
"489",11906,"Kaplan GRE Premier 2014 with 6 Practice Tests: book + online + DVD + mobile","Kaplan"
"490",12064,"The Longest Ride","Nicholas Sparks"
"491",14339,"Life Code: The New Rules for Winning in the Real World","Phil McGraw"
"492",13565,"The Lego Ideas Book: Unlock Your Imagination","Daniel Lipkowitz"
"493",12361,"A Memory of Light (Wheel of Time, Book 14) (Wheel of Time, 14)","Robert Jordan"
"494",14846,"StrengthsFinder 2.0","Gallup"
"495",13738,"Frozen (Little Golden Book)","RH Disney"
"496",12021,"Laugh-Out-Loud Jokes for Kids","Rob Elliott"
"497",12631,"The Fault in Our Stars","John Green"
"498",11134,"Diary of a Wimpy Kid: The Long Haul","Jeff Kinney"
"499",14871,"What If?: Serious Scientific Answers to Absurd Hypothetical Questions","Randall Munroe"
"500",14915,"The Blood of Olympus (The Heroes of Olympus, 5)","Rick Riordan"
"501",12827,"Jesus Calling, Padded Hardcover, with Scripture references","Sarah Young"
"502",12477,"Unbroken: A World War II Story of Survival, Resilience, and Redemption","Laura Hillenbrand"
"503",13258,"Ultimate Sticker Book: Frozen: More Than 60 Reusable Full-Color Stickers","DK"
"504",14977,"The Day the Crayons Quit","Drew Daywalt"
"505",14373,"Divergent","Veronica Roth"
"506",13745,"The Fault in Our Stars","John Green"
"507",13955,"Oh, the Places You'll Go!","Dr. Seuss"
"508",14639,"To Kill a Mockingbird","Harper Lee"
"509",11053,"Gone Girl","Gillian Flynn"
"510",12436,"The Book Thief","Markus Zusak"
"511",12545,"The Official SAT Study Guide","The College Board"
"512",13832,"Humans of New York","Brandon Stanton"
"513",12640,"The Goldfinch: A Novel (Pulitzer Prize for Fiction)","Donna Tartt"
"514",14861,"Diagnostic and Statistical Manual of Mental Disorders, 5th Edition: DSM-5","American Psychiatric Association"
"515",12629,"Wonder","R. J. Palacio"
"516",13435,"The Book with No Pictures","B. J. Novak"
"517",14829,"Rush Revere and the First Patriots: Time-Travel Adventures With Exceptional Americans (2)","Rush Limbaugh"
"518",14157,"The 5 Love Languages: The Secret to Love That Lasts","Gary Chapman"
"519",12953,"Knock-Knock Jokes for Kids (Laugh-Out-Loud Jokes for Kids)","Rob Elliott"
"520",13982,"JOURNEY TO THE ICE P","RH Disney"
"521",13363,"Publication Manual of the American Psychological Association, 6th Edition","American Psychological Association"
"522",13163,"Little Blue Truck","Alice Schertle"
"523",12321,"Make It Ahead: A Barefoot Contessa Cookbook","Ina Garten"
"524",12060,"First 100 Words: A Padded Board Book","Roger Priddy"
"525",11107,"If I Stay","Gayle Forman"
"526",13544,"A Game of Thrones / A Clash of Kings / A Storm of Swords / A Feast of Crows / A Dance with Dragons","George R. R. Martin"
"527",13573,"Divergent / Insurgent","Veronica Roth"
"528",14091,"Capital in the Twenty First Century","Thomas Piketty"
"529",14886,"Orphan Train","Christina Baker Kline"
"530",12925,"Mindset: The New Psychology of Success","Carol S. Dweck"
"531",13057,"How to Win Friends & Influence People","Dale Carnegie"
"532",14561,"The Very Hungry Caterpillar","Eric Carle"
"533",13733,"All the Light We Cannot See","Anthony Doerr"
"534",13589,"Grain Brain: The Surprising Truth about Wheat, Carbs, and Sugar--Your Brain's Silent Killers","David Perlmutter MD"
"535",11283,"Unbroken: A World War II Story of Survival, Resilience, and Redemption","Laura Hillenbrand"
"536",13848,"Thug Kitchen: The Official Cookbook: Eat Like You Give a F*ck (Thug Kitchen Cookbooks)","Thug Kitchen"
"537",14706,"The Alchemist","Paulo Coelho"
"538",14069,"Looking for Alaska","John Green"
"539",14924,"The Great Gatsby: The Only Authorized Edition","F. Scott Fitzgerald"
"540",12916,"The Boys in the Boat: Nine Americans and Their Epic Quest for Gold at the 1936 Berlin Olympics","Daniel James Brown"
"541",14529,"Love You Forever","Robert Munsch"
"542",14382,"The Maze Runner (Book 1)","James Dashner"
"543",13324,"Allegiant","Veronica Roth"
"544",11463,"Yes Please","Amy Poehler"
"545",13428,"The Five Dysfunctions of a Team: A Leadership Fable, 20th Anniversary Edition","Patrick Lencioni"
"546",11914,"The Four Agreements: A Practical Guide to Personal Freedom (A Toltec Wisdom Book)","Don Miguel Ruiz"
"547",12997,"The 7 Habits of Highly Effective People: Powerful Lessons in Personal Change","Stephen R. Covey"
"548",11645,"41: A Portrait of My Father","George W. Bush"
"549",12591,"Minecraft: The Complete Handbook Collection","Stephanie Milton"
"550",13655,"Frozen: A Tale of Two Sisters","Melissa Lagonegro"
"551",14957,"Rush Revere and the Brave Pilgrims: Time-Travel Adventures with Exceptional Americans (1)","Rush Limbaugh"
"552",13497,"The Gifts of Imperfection: Let Go of Who You Think You're Supposed to Be and Embrace Who You Are","Brené Brown"
"553",14462,"Divergent / Insurgent / Allegiant","Veronica Roth"
"554",14082,"Heaven is for Real: A Little Boy's Astounding Story of His Trip to Heaven and Back","Todd Burpo"
"555",12453,"Flash Boys","Michael Lewis"
"556",11628,"Rush Revere and the American Revolution: Time-Travel Adventures With Exceptional Americans","Rush Limbaugh"
"557",14094,"Dear Zoo: A Lift-the-Flap Book","Rod Campbell"
"558",14722,"The Going-To-Bed Book","Sandra Boynton"
"559",12989,"The World of Ice & Fire: The Untold History of Westeros and the Game of Thrones","George R. R. Martin"
"560",11932,"The Real ACT Prep Guide","ACT"
"561",13485,"Gray Mountain: A Novel","John Grisham"
"562",13125,"What to Expect When You're Expecting","Heidi Murkoff"
"563",13972,"The Jesus Storybook Bible: Every Story Whispers His Name","Sally Lloyd-Jones"
"564",13620,"Lean In: Women, Work, and the Will to Lead","Sheryl Sandberg"
"565",12789,"The Invention of Wings","Sue Monk Kidd"
"566",14045,"Lord of the Flies","William Golding"
"567",14103,"Night (Night)","Elie Wiesel"
"568",11701,"The Catcher in the Rye","J.D. Salinger"
"569",12389,"Soul Healing Miracles: Ancient and New Sacred Wisdom, Knowledge, and Practical Techniques for Healing the Spiritual, Mental, Emotional, and Physical Bodies","Zhi Gang Sha"
"570",11851,"The Care and Keeping of You: The Body Book for Younger Girls, Revised Edition (American Girl Library)","Valorie Schaefer"
"571",12973,"The Skinnytaste Cookbook: Light on Calories, Big on Flavor","Gina Homolka"
"572",12040,"Fahrenheit 451","Ray Bradbury"
"573",14785,"Goodnight, Goodnight Construction Site (Hardcover Books for Toddlers, Preschool Books for Kids)","Sherri Duskey Rinker"
"574",11225,"Paper Towns","John Green"
"575",13123,"The Everything Kids' Science Experiments Book: Boil Ice, Float Water, Measure Gravity-Challenge the World Around You!","Tom Robinson"
"576",14707,"1984","George Orwell"
"577",12680,"The Outsiders","S. E. Hinton"
"578",13182,"MONEY Master the Game: 7 Simple Steps to Financial Freedom","Tony Robbins"
"579",12586,"Goodnight Moon","Margaret Wise Brown"
"580",14422,"Quiet: The Power of Introverts in a World That Can't Stop Talking","Susan Cain"
"581",13878,"Revival: A Novel","Stephen King"
"582",14001,"Giraffes Can't Dance","Giles Andreae"
"583",11281,"Minecraft: Redstone Handbook: An Official Mojang Book","Scholastic"
"584",11405,"Of Mice and Men","John Steinbeck"
"585",12222,"10-Day Green Smoothie Cleanse: Lose Up to 15 Pounds in 10 Days!","JJ Smith"
"586",14862,"Crucial Conversations Tools for Talking When Stakes Are High, Second Edition","Kerry Patterson"
"587",12512,"A Day in the Sun (Disney Frozen) (Pictureback(R))","Frank Berrios"
"588",12164,"The Giver (Giver Quartet)","Lois Lowry"
"589",13457,"Chicka Chicka Boom Boom (Board Book)","Bill Martin Jr."
"590",11261,"Against All Grain: Delectable Paleo Recipes To Eat Well And Feel Great","Danielle Walker"
"591",14835,"Minecraft: Essential Handbook","Stephanie Milton"
"592",11304,"Good to Great: Why Some Companies Make the Leap and Others Don't","Jim Collins"
"593",11048,"First 100 Words: A Padded Board Book","Roger Priddy"
"594",12270,"The Life-Changing Magic of Tidying Up: The Japanese Art of Decluttering and Organizing","Marie Kondō"
"595",13450,"Laugh-Out-Loud Jokes for Kids","Rob Elliott"
"596",11045,"Secret Garden: An Inky Treasure Hunt and Coloring Book for Adults","Johanna Basford"
"597",11535,"StrengthsFinder 2.0","Gallup"
"598",13718,"Go Set a Watchman: A Novel","Harper Lee"
"599",12860,"Enchanted Forest: An Inky Quest and Coloring book (Activity Books, Mindfulness and Meditation, Illustrated Floral Prints)","Johanna Basford"
"600",12305,"All the Light We Cannot See","Anthony Doerr"
"601",14155,"The Girl on the Train","Paula Hawkins"
"602",12626,"Adult Coloring Book: Stress Relieving Patterns","Blue Star Coloring"
"603",13664,"Diary of a Wimpy Kid #10: Old School","Jeff Kinney"
"604",13221,"To Kill a Mockingbird","Harper Lee"
"605",13214,"Adult Coloring Book: Stress Relieving Animal Designs","Blue Star Coloring"
"606",14515,"Adult Coloring Books: A Coloring Book for Adults Featuring Mandalas and Henna Inspired Flowers, Animals, and Paisley Patterns","Coloring Books for Adults"
"607",13045,"Humans of New York : Stories","Brandon Stanton"
"608",12127,"The Martian","Andy Weir"
"609",12759,"Oh, the Places You'll Go!Â Â ","Dr. Seuss"
"610",13151,"Knock-Knock Jokes for Kids (Laugh-Out-Loud Jokes for Kids)","Rob Elliott"
"611",12987,"Dear Zoo: A Lift-the-Flap Book","Rod Campbell"
"612",11298,"The Day the Crayons Quit","Drew Daywalt"
"613",12615,"The Boys in the Boat: Nine Americans and Their Epic Quest for Gold at the 1936 Berlin Olympics","Daniel James Brown"
"614",13081,"Jesus Calling, Padded Hardcover, with Scripture references","Sarah Young"
"615",12310,"Mindset: The New Psychology of Success","Carol S. Dweck"
"616",12676,"Grey: Fifty Shades of Grey as Told by Christian (Fifty Shades Of Grey Series, 4)","E L James"
"617",11385,"Creative Haven Creative Cats Coloring Book (Adult Coloring)","Marjorie Sarnat"
"618",14192,"How to Win Friends & Influence People","Dale Carnegie"
"619",14115,"The 5 Love Languages: The Secret to Love that Lasts","Gary Chapman"
"620",12213,"Balance (Angie's  Extreme Stress Menders)","Angie Grace"
"621",11861,"Creative Haven Owls Coloring Book (Adult Coloring)","Marjorie Sarnat"
"622",11124,"Thug Kitchen: The Official Cookbook: Eat Like You Give a F*ck (Thug Kitchen Cookbooks)","Thug Kitchen"
"623",12621,"Giraffes Can't Dance","Giles Andreae"
"624",14666,"Wonder","R. J. Palacio"
"625",14648,"The 7 Habits of Highly Effective People: Powerful Lessons in Personal Change","Stephen R. Covey"
"626",11848,"The Four Agreements: A Practical Guide to Personal Freedom (A Toltec Wisdom Book)","Don Miguel Ruiz"
"627",11323,"Being Mortal: Medicine and What Matters in the End","Atul Gawande"
"628",13918,"Love You Forever","Robert Munsch"
"629",12593,"The Very Hungry Caterpillar","Eric Carle"
"630",11039,"Publication Manual of the American Psychological Association, 6th Edition","American Psychological Association"
"631",11219,"Between the World and Me","Ta-Nehisi Coates"
"632",14764,"Baby Touch and Feel: Animals","DK"
"633",13885,"The Book with No Pictures","B. J. Novak"
"634",13721,"The Wright Brothers","David McCullough"
"635",11078,"Dover Creative Haven Art Nouveau Animal Designs Coloring Book (Creative Haven Coloring Books)","Marty Noble"
"636",12550,"The Nightingale: A Novel","Kristin Hannah"
"637",12861,"The Pioneer Woman Cooks: Dinnertime - Comfort Classics, Freezer Food, 16-minute Meals, and Other Delicious Ways to Solve Supper","Ree Drummond"
"638",11429,"What Pet Should I Get? (Classic Seuss)","Dr. Seuss"
"639",11763,"Killing Reagan: The Violent Assault That Changed a Presidency (Bill O'Reilly's Killing Series)","Bill O'Reilly"
"640",12859,"Harry Potter Coloring Book","Scholastic"
"641",11025,"American Sniper: The Autobiography of the Most Lethal Sniper in U.S. Military History","Chris Kyle"
