"","book_id","title","author"
"1",14548,"The Lost Symbol","Dan Brown"
"2",13314,"The Shack: Where Tragedy Confronts Eternity","William P. Young"
"3",14138,"Liberty and Tyranny: A Conservative Manifesto","Mark R. Levin"
"4",14681,"Breaking Dawn (The Twilight Saga, Book 4)","Stephenie Meyer"
"5",13118,"Going Rogue: An American Life","Sarah Palin"
"6",14660,"StrengthsFinder 2.0","Gallup"
"7",12082,"The Help","Kathryn Stockett"
"8",11971,"New Moon (The Twilight Saga)","Stephenie Meyer"
"9",13893,"The Twilight Saga Collection","Stephenie Meyer"
"10",13902,"Outliers: The Story of Success","Malcolm Gladwell"
"11",12562,"Eclipse (Twilight)","Stephenie Meyer"
"12",14489,"Twilight (The Twilight Saga, Book 1)","Stephenie Meyer"
"13",12474,"Glenn Beck's Common Sense: The Case Against an Out-of-Control Government, Inspired by Thomas Paine","Glenn Beck"
"14",11516,"Three Cups of Tea: One Man's Mission to Promote Peace - One School at a Time","Greg Mortenson"
"15",13410,"The Love Dare","Stephen Kendrick"
"16",12803,"Act Like a Lady, Think Like a Man: What Men Really Think About Love, Relationships, Intimacy, and Commitment","Steve Harvey"
"17",11440,"Dog Days (Diary of a Wimpy Kid, Book 4) (Volume 4)","Jeff Kinney"
"18",12511,"Under the Dome: A Novel","Stephen King"
"19",14582,"The Guernsey Literary and Potato Peel Pie Society","Mary Ann Shaffer"
"20",12639,"Eat This Not That! Supermarket Survival Guide: The No-Diet Weight Loss Solution","David Zinczenko"
"21",13995,"Arguing with Idiots: How to Stop Small Minds and Big Government","Glenn Beck"
"22",11426,"Mastering the Art of French Cooking, Volume I: 50th Anniversary Edition: A Cookbook","Julia Child"
"23",12125,"Sookie Stackhouse","Charlaine Harris"
"24",14514,"The Time Traveler's Wife","Audrey Niffenegger"
"25",13615,"Publication Manual of the American Psychological Association, 6th Edition","American Psychological Association"
"26",12403,"True Compass: A Memoir","Edward M. Kennedy"
"27",11011,"The Girl with the Dragon Tattoo (Millennium Series)","Stieg Larsson"
"28",12446,"The 5000 Year Leap","W. Cleon Skousen"
"29",11566,"Good to Great: Why Some Companies Make the Leap and Others Don't","Jim Collins"
"30",12940,"Eclipse (Twilight Sagas)","Stephenie Meyer"
"31",12979,"Where the Wild Things Are","Maurice Sendak"
"32",13977,"The Five Dysfunctions of a Team: A Leadership Fable, 20th Anniversary Edition","Patrick Lencioni"
"33",14595,"Olive Kitteridge","Elizabeth Strout"
"34",11181,"Dead And Gone: A Sookie Stackhouse Novel (Sookie Stackhouse/True Blood)","Charlaine Harris"
"35",11049,"Eat This, Not That! Thousands of Simple Food Swaps that Can Save You 10, 20, 30 Pounds--or More!","David Zinczenko"
"36",14671,"Super Freakonomics: Global Cooling, Patriotic Prostitutes, and Why Suicide Bombers Should Buy Life Insurance","Steven D. Levitt"
"37",12475,"The Tipping Point: How Little Things Can Make a Big Difference","Malcolm Gladwell"
"38",12784,"Crazy Love: Overwhelmed by a Relentless God","Francis Chan"
"39",12414,"The Last Olympian (Percy Jackson and the Olympians, Book 5)","Rick Riordan"
"40",13591,"The Elegance of the Hedgehog","Muriel Barbery"
"41",12543,"I, Alex Cross","James Patterson"
"42",13481,"The Girl Who Played with Fire (Millennium)","Stieg Larsson"
"43",14616,"The Last Lecture","Randy Pausch"
"44",11997,"The Five Love Languages: How to Express Heartfelt Commitment to Your Mate","Gary Chapman"
"45",12279,"Watchmen","Alan Moore"
"46",12598,"The 7 Habits of Highly Effective People: Powerful Lessons in Personal Change","Stephen R. Covey"
"47",11732,"The Book of Basketball: The NBA According to The Sports Guy","Bill Simmons"
"48",11736,"Divine Soul Mind Body Healing and Transmission System: The Divine Way to Heal You, Humanity, Mother Earth, and All Universes","Zhi Gang Sha"
"49",12274,"Diary of a Wimpy Kid Do-it-yourself Book","Jeff Kinney"
"50",13290,"Open: An Autobiography","Andre Agassi"
"51",11700,"Pride and Prejudice and Zombies","Jane Austen"
"52",12428,"Cook Yourself Thin: Skinny Meals You Can Make in Minutes","Lifetime Television,"
"53",12974,"Hungry Girl: 200 Under 200: 200 Recipes Under 200 Calories","Lisa Lillien"
"54",13814,"Born to Run: A Hidden Tribe, Superathletes, and the Greatest Race the World Has Never Seen","Christopher McDougall"
"55",14240,"A Bold Fresh Piece of Humanity","Bill O'Reilly"
"56",12617,"The Pioneer Woman Cooks: Recipes from an Accidental Country Girl","Ree Drummond"
"57",14537,"The Book Thief","Markus Zusak"
"58",13914,"South of Broad","Pat Conroy"
"59",12142,"The Omnivore's Dilemma: A Natural History of Four Meals","Michael Pollan"
"60",14717,"The Host","Stephenie Meyer"
"61",12519,"Master Your Metabolism: The 3 Diet Secrets to Naturally Balancing Your Hormones for a Hot and Healthy Body!","Jillian Michaels"
"62",14356,"Ford County: Stories","John Grisham"
"63",12316,"Culture of Corruption: Obama and His Team of Tax Cheats, Crooks, and Cronies","Michelle Malkin"
"64",14864,"Blink: The Power of Thinking Without Thinking","Malcolm Gladwell"
"65",13340,"Diary of a Wimpy Kid, Book 1","Jeff Kinney"
"66",11960,"The Graveyard Book","Neil Gaiman"
"67",12008,"An Echo in the Bone (Outlander)","Diana Gabaldon"
"68",13117,"The Gathering Storm (Wheel of Time, Book 12)","Robert Jordan"
"69",13896,"Dreams from My Father: A Story of Race and Inheritance","Barack Obama"
"70",12583,"Pirate Latitudes: A Novel","Michael Crichton"
"71",14460,"The Official SAT Study Guide: For the New SAT (tm)","The College Board"
"72",13543,"Getting Things Done: The Art of Stress-Free Productivity","David Allen"
"73",14086,"How to Win Friends & Influence People","Dale Carnegie"
"74",13112,"The Official SAT Study Guide","The College Board"
"75",11976,"Finger Lickin' Fifteen (A Stephanie Plum Novel) (Stephanie Plum Novels)","Janet Evanovich"
"76",12509,"Sarah's Key","Tatiana de Rosnay"
"77",11248,"From Dead to Worse (Sookie Stackhouse/True Blood)","Charlaine Harris"
"78",12910,"Wolf Hall","Hilary Mantel"
"79",14132,"The Hunger Games","Suzanne Collins"
"80",14729,"The Yankee Years","Joe Torre"
"81",11506,"Push: A Novel","Sapphire"
"82",13621,"The End of Overeating: Taking Control of the Insatiable American Appetite","David Kessler"
"83",14125,"The Lacuna: A Novel","Barbara Kingsolver"
"84",14140,"Crucial Conversations: Tools for Talking When Stakes are High","Kerry Patterson"
"85",12728,"Half the Sky: Turning Oppression into Opportunity for Women Worldwide","Nicholas D. Kristof"
"86",13106,"The Associate","John Grisham"
"87",12326,"Artisan Bread in Five Minutes a Day: The Discovery That Revolutionizes Home Baking","Jeff Hertzberg"
"88",14000,"Three Cups of Tea: One Man's Journey to Change the World... One Child at a Time (Young Reader's Edition)","Sarah Thomson"
"89",13654,"Pursuit of Honor","Vince Flynn"
"90",11556,"What the Dog Saw: And Other Adventures","Malcolm Gladwell"
"91",12589,"The Last Song","Nicholas Sparks"
"92",11461,"Atlas Shrugged","Ayn Rand"
"93",14404,"The White Tiger: A Novel","Aravind Adiga"
"94",11911,"Now, Discover Your Strengths: The revolutionary Gallup program that shows you how to develop your unique talents and strengths","Gallup"
"95",11501,"Same Kind of Different As Me","Ron Hall"
"96",13219,"U is for Undertow: A Kinsey Millhone Novel","Sue Grafton"
"97",14500,"Catching Fire (The Hunger Games)","Suzanne Collins"
"98",12018,"The Girl Who Kicked the Hornet's Nest (Millennium Trilogy)","Stieg Larsson"
"99",11421,"The Girl with the Dragon Tattoo (Millennium Series)","Stieg Larsson"
"100",13557,"Decision Points","George W. Bush"
"101",14182,"The Help","Kathryn Stockett"
"102",14792,"The Girl Who Played with Fire (Millennium Series)","Stieg Larsson"
"103",14406,"The Ugly Truth (Diary of a Wimpy Kid, Book 5)","Jeff Kinney"
"104",14972,"StrengthsFinder 2.0","Gallup"
"105",12957,"Mockingjay (The Hunger Games)","Suzanne Collins"
"106",11638,"Women Food and God: An Unexpected Path to Almost Everything","Geneen Roth"
"107",14923,"Publication Manual of the American Psychological Association, 6th Edition","American Psychological Association"
"108",14941,"Autobiography of Mark Twain, Vol. 1","Mark Twain"
"109",11981,"The Big Short: Inside the Doomsday Machine","Michael Lewis"
"110",13392,"Food Rules: An Eater's Manual","Michael Pollan"
"111",12210,"Unbroken: A World War II Story of Survival, Resilience, and Redemption","Laura Hillenbrand"
"112",11965,"Dead in the Family (Sookie Stackhouse/True Blood, Book 10)","Charlaine Harris"
"113",14026,"Sh*t My Dad Says","Justin Halpern"
"114",13113,"Crazy Love: Overwhelmed by a Relentless God","Francis Chan"
"115",13835,"The Short Second Life of Bree Tanner: An Eclipse Novella (The Twilight Saga)","Stephenie Meyer"
"116",11694,"Life","Keith Richards"
"117",14213,"Cutting for Stone","Abraham Verghese"
"118",13635,"The Daily Show with Jon Stewart Presents Earth (The Book): A Visitor's Guide to the Human Race","Jon Stewart"
"119",12107,"The Official SAT Study Guide","The College Board"
"120",12263,"Game Change: Obama and the Clintons, McCain and Palin, and the Race of a Lifetime","John Heilemann"
"121",11410,"The Immortal Life of Henrietta Lacks","Rebecca Skloot"
"122",11168,"The Lost Hero (Heroes of Olympus, Book 1)","Rick Riordan"
"123",14604,"Teach Like a Champion: 49 Techniques that Put Students on the Path to College","Doug Lemov"
"124",13228,"Outliers: The Story of Success","Malcolm Gladwell"
"125",12652,"Catching Fire (The Hunger Games)","Suzanne Collins"
"126",11723,"The Five Dysfunctions of a Team: A Leadership Fable, 20th Anniversary Edition","Patrick Lencioni"
"127",12748,"Good to Great: Why Some Companies Make the Leap and Others Don't","Jim Collins"
"128",11202,"Three Cups of Tea: One Man's Mission to Promote Peace - One School at a Time","Greg Mortenson"
"129",14859,"The Road to Serfdom: Text and Documents--The Definitive Edition (The Collected Works of F. A. Hayek, Volume 2)","F. A. Hayek"
"130",12751,"The Confession: A Novel","John Grisham"
"131",12753,"Delivering Happiness: A Path to Profits, Passion, and Purpose","Tony Hsieh"
"132",14512,"A Patriot's History of the United States: From Columbus's Great Discovery to the War on Terror","Larry Schweikart"
"133",11233,"The Last Olympian (Percy Jackson and the Olympians, Book 5)","Rick Riordan"
"134",11080,"Switch: How to Change Things When Change Is Hard","Chip Heath"
"135",14696,"The Art of Racing in the Rain: A Novel","Garth Stein"
"136",12464,"The 5 Love Languages: The Secret to Love That Lasts","Gary Chapman"
"137",14196,"Broke: The Plan to Restore Our Trust, Truth and Treasure","Glenn Beck"
"138",14637,"The Red Pyramid (The Kane Chronicles, Book 1)","Rick Riordan"
"139",12317,"Percy Jackson and the Olympians Paperback Boxed Set (Books 1-3)","Rick Riordan"
"140",13901,"Little Bee: A Novel","Chris Cleave"
"141",12276,"Barefoot Contessa, How Easy Is That?: Fabulous Recipes & Easy Tips","Ina Garten"
"142",11256,"George Washington's Sacred Fire","Peter A. Lillback"
"143",11033,"Radical: Taking Back Your Faith from the American Dream","David Platt"
"144",13288,"Towers of Midnight (Wheel of Time, Book Thirteen)","Robert Jordan"
"145",12015,"Sarah's Key","Tatiana de Rosnay"
"146",12415,"The Hunger Games","Suzanne Collins"
"147",14451,"The 7 Habits of Highly Effective People: Powerful Lessons in Personal Change","Stephen R. Covey"
"148",13840,"Cleopatra: A Life","Stacy Schiff"
"149",13630,"Freedom: A Novel","Jonathan Franzen"
"150",13821,"Freedom","Jonathan Franzen"
"151",13879,"Born to Run: A Hidden Tribe, Superathletes, and the Greatest Race the World Has Never Seen","Christopher McDougall"
"152",14689,"Fall of Giants (The Century Trilogy)","Ken Follett"
"153",13930,"Eat, Pray, Love: One Woman's Search for Everything Across Italy, India and Indonesia","Elizabeth Gilbert"
"154",13984,"Eat Pray Love: One Woman's Search for Everything Across Italy, India and Indonesia","Elizabeth Gilbert"
"155",13989,"Tao I: The Way of All Life","Zhi Gang Sha Dr."
"156",11804,"Chelsea Chelsea Bang Bang","Chelsea Handler"
"157",12764,"Let the Great World Spin: A Novel","Colum McCann"
"158",13269,"The Pioneer Woman Cooks: Recipes from an Accidental Country Girl","Ree Drummond"
"159",12518,"The Tipping Point: How Little Things Can Make a Big Difference","Malcolm Gladwell"
"160",11353,"The Omnivore's Dilemma: A Natural History of Four Meals","Michael Pollan"
"161",13114,"The Belly Fat Cure: Discover the New Carb Swap Systemâ„¢ and Lose 4 to 9 lbs. Every Week","Jorge Cruise"
"162",13299,"The Battle of the Labyrinth (Percy Jackson and the Olympians, Book 4)","Rick Riordan"
"163",12093,"The 4-Hour Workweek: Escape 9-5, Live Anywhere, and Join the New Rich","Timothy Ferriss"
"164",12139,"Full Dark, No Stars","Stephen King"
"165",13786,"Sizzling Sixteen (Stephanie Plum Novels)","Janet Evanovich"
"166",12879,"The Grand Design","Stephen Hawking"
"167",13431,"The Overton Window","Glenn Beck"
"168",12302,"Jesus Calling, Padded Hardcover, with Scripture references","Sarah Young"
"169",13046,"Spoken from the Heart","Laura Bush"
"170",12257,"Diary of a Wimpy Kid Do-it-yourself Book","Jeff Kinney"
"171",13904,"The Book of Awakening: Having the Life You Want by Being Present to the Life You Have","Mark Nepo"
"172",12673,"Mastering the Art of French Cooking, Volume I: 50th Anniversary Edition: A Cookbook","Julia Child"
"173",11138,"Safe Haven","Nicholas Sparks"
"174",13357,"Change Your Brain, Change Your Body: Use Your Brain to Get and Keep the Body You Have Always Wanted","Daniel G. Amen"
"175",11443,"The Kind Diet: A Simple Guide to Feeling Great, Losing Weight, and Saving the Planet","Alicia Silverstone"
"176",11027,"Decoded","Jay-Z"
"177",11280,"The Glass Castle: A Memoir (book)","Jeannette Walls"
"178",13539,"The Shack: Where Tragedy Confronts Eternity","William P. Young"
"179",12546,"Breaking Dawn (The Twilight Saga, Book 4)","Stephenie Meyer"
"180",14083,"Sookie Stackhouse 8-copy Boxed Set (Sookie Stackhouse / Southern Vampire)","Charlaine Harris"
"181",14807,"The Guernsey Literary and Potato Peel Pie Society","Mary Ann Shaffer"
"182",14437,"Hotel on the Corner of Bitter and Sweet","Jamie Ford"
"183",14712,"The 4 Hour Body: An Uncommon Guide to Rapid Fat Loss, Incredible Sex and Becoming Superhuman","Timothy Ferriss"
"184",14789,"Crucial Conversations: Tools for Talking When Stakes are High","Kerry Patterson"
"185",11321,"Happy Ever After (Bride Quartet, Book 4)","Nora Roberts"
"186",13475,"A Guide to the Project Management Body of Knowledge","Project Management Institute"
"187",12214,"The Book Thief","Markus Zusak"
"188",11235,"The Catcher in the Rye","J. D. Salinger"
"189",12293,"The China Study: The Most Comprehensive Study of Nutrition Ever Conducted And the Startling Implications for Diet, Weight Loss, And Long-term Health","Thomas Campbell"
"190",14659,"American Assassin: A Thriller (A Mitch Rapp Novel)","Vince Flynn"
"191",13988,"Rework","Jason Fried"
"192",11318,"In Defense of Food: An Eater's Manifesto","Michael Pollan"
"193",13491,"Squirrel Seeks Chipmunk: A Modest Bestiary","David Sedaris"
"194",13051,"Who Moved My Cheese","Spencer Johnson"
"195",11708,"Steve Jobs","Walter Isaacson"
"196",14599,"Heaven is for Real: A Little Boy's Astounding Story of His Trip to Heaven and Back","Todd Burpo"
"197",11777,"Cabin Fever (Diary of a Wimpy Kid, Book 6)","Jeff Kinney"
"198",12767,"StrengthsFinder 2.0","Gallup"
"199",14139,"The Hunger Games (Book 1)","Suzanne Collins"
"200",14605,"Unbroken: A World War II Story of Survival, Resilience, and Redemption","Laura Hillenbrand"
"201",13779,"Inheritance: Book IV (Inheritance Cycle)","Christopher Paolini"
"202",11295,"Go the F**k to Sleep","Adam Mansbach"
"203",12441,"Mockingjay (The Hunger Games)","Suzanne Collins"
"204",14439,"Game of Thrones Boxed Set: A Game of Thrones/A Clash of Kings/A Storm of Swords/A Feast for Crows","George R.R. Martin"
"205",14185,"Catching Fire (The Hunger Games)","Suzanne Collins"
"206",13657,"The 17 Day Diet: A Doctor's Plan Designed for Rapid Results","Mike Moreno"
"207",12785,"A Dance with Dragons (A Song of Ice and Fire)","George R. R. Martin"
"208",14560,"The Son of Neptune (Heroes of Olympus, Book 2)","Rick Riordan"
"209",11998,"Killing Lincoln: The Shocking Assassination that Changed America Forever (Bill O'Reilly's Killing Series)","Bill O'Reilly"
"210",12874,"Publication Manual of the American Psychological Association, 6th Edition","American Psychological Association"
"211",12306,"The Help","Kathryn Stockett"
"212",14329,"The Immortal Life of Henrietta Lacks","Rebecca Skloot"
"213",12246,"11/22/63: A Novel","Stephen King"
"214",14541,"The Official SAT Study Guide","The College Board"
"215",14980,"Jesus Calling, Padded Hardcover, with Scripture references","Sarah Young"
"216",12899,"The Hunger Games Trilogy Boxed Set","Suzanne Collins"
"217",12051,"Cutting for Stone","Abraham Verghese"
"218",11185,"Tina Fey: Bossypants","Tina Fey"
"219",13936,"The 4 Hour Body: An Uncommon Guide to Rapid Fat Loss, Incredible Sex and Becoming Superhuman","Timothy Ferriss"
"220",14063,"In the Garden of Beasts: Love, Terror, and an American Family in Hitler's Berlin","Eric Larson"
"221",11622,"The 5 Love Languages: The Secret to Love That Lasts","Gary Chapman"
"222",13233,"Crazy Love: Overwhelmed by a Relentless God","Francis Chan"
"223",14669,"A Stolen Life: A Memoir","Jaycee Dugard"
"224",11618,"The Girl Who Kicked the Hornet's Nest (Millennium Trilogy)","Stieg Larsson"
"225",14226,"Water for Elephants: A Novel","Sara Gruen"
"226",13315,"The Five Dysfunctions of a Team: A Leadership Fable, 20th Anniversary Edition","Patrick Lencioni"
"227",11294,"The Lego Ideas Book: Unlock Your Imagination","Daniel Lipkowitz"
"228",13342,"One Thousand Gifts: A Dare to Live Fully Right Where You Are","Ann Voskamp"
"229",11881,"The 7 Habits of Highly Effective People: Powerful Lessons in Personal Change","Stephen R. Covey"
"230",12656,"The Throne of Fire (The Kane Chronicles, Book 2)","Rick Riordan"
"231",11840,"Dead Reckoning (Sookie Stackhouse/True Blood, Book 11)","Charlaine Harris"
"232",14459,"Good to Great: Why Some Companies Make the Leap and Others Don't","Jim Collins"
"233",14146,"The Litigators","John Grisham"
"234",11711,"Love Wins: A Book About Heaven, Hell, and the Fate of Every Person Who Ever Lived","Rob Bell"
"235",12075,"The Help","Kathryn Stockett"
"236",13729,"Thinking, Fast and Slow","Daniel Kahneman"
"237",14849,"The Paris Wife: A Novel","Paula McLain"
"238",13851,"Radical: Taking Back Your Faith from the American Dream","David Platt"
"239",11417,"The Art of Racing in the Rain: A Novel","Garth Stein"
"240",11854,"Teach Like a Champion: 49 Techniques that Put Students on the Path to College","Doug Lemov"
"241",11167,"Eat to Live: The Amazing Nutrient-Rich Program for Fast and Sustained Weight Loss, Revised Edition","Joel Fuhrman MD"
"242",11887,"The China Study: The Most Comprehensive Study of Nutrition Ever Conducted And the Startling Implications for Diet, Weight Loss, And Long-term Health","Thomas Campbell"
"243",12527,"What to Expect When You're Expecting","Heidi Murkoff"
"244",11511,"The Best of Me","Nicholas Sparks"
"245",14781,"Jacqueline Kennedy: Historic Conversations on Life with John F. Kennedy","Jacqueline Kennedy"
"246",14694,"The Girl with the Dragon Tattoo (Millennium Series)","Stieg Larsson"
"247",11717,"The Greater Journey: Americans in Paris","David McCullough"
"248",13571,"Switch: How to Change Things When Change Is Hard","Chip Heath"
"249",13244,"Every Thing On It","Shel Silverstein"
"250",14641,"Miss Peregrine's Home for Peculiar Children","Ransom Riggs"
"251",12438,"Moonwalking With Einstein: The Art and Science of Remembering Everything","Joshua Foer"
"252",12755,"The Great Gatsby: The Only Authorized Edition","F. Scott Fitzgerald"
"253",12409,"The Help","Kathryn Stockett"
"254",13534,"1Q84: A novel","Haruki Murakami"
"255",14880,"Boomerang: Travels in the New Third World","Michael Lewis"
"256",12547,"Who Moved My Cheese","Spencer Johnson"
"257",11776,"Strengths Based Leadership: Great Leaders, Teams, and Why People Follow","Tom Rath"
"258",14594,"Elder Scrolls V: Skyrim: Prima Official Game Guide","David Hodgson"
"259",13307,"The Glass Castle: A Memoir (book)","Jeannette Walls"
"260",11571,"The Book Thief","Markus Zusak"
"261",11286,"The 4-Hour Workweek: Escape 9-5, Live Anywhere, and Join the New Rich","Timothy Ferriss"
"262",12808,"Oh, the Places You'll Go!","Dr. Seuss"
"263",11921,"Through My Eyes","Tim Tebow"
"264",14896,"The Land of Painted Caves: A Novel (Earth's Children)","Jean M. Auel"
"265",11404,"The Social Animal: The Hidden Sources of Love, Character, and Achievement","David Brooks"
"266",12180,"A Guide to the Project Management Body of Knowledge","Project Management Institute"
"267",12356,"Guinness World Records 2012","Guinness World Records"
"268",11825,"State of Wonder","Ann Patchett"
"269",13694,"A Visit from the Goon Squad","Jennifer Egan"
"270",11186,"Prevent And Reverse Heart Disease: The Revolutionary, Scientifically Proven, Nutrition-Based Cure","Caldwell B. Esselstyn Jr."
"271",12252,"Harry Potter Paperback Box Set (Books 1-7)","J. K. Rowling"
"272",11044,"Explosive Eighteen: A Stephanie Plum Novel (Stephanie Plum Novels)","Janet Evanovich"
"273",14633,"The 7 Habits of Highly Effective Teens: The Ultimate Teenage Success Guide","Sean Covey"
"274",12750,"Delivering Happiness: A Path to Profits, Passion, and Purpose","Tony Hsieh"
"275",14317,"The Lost Hero (Heroes of Olympus, Book 1)","Rick Riordan"
"276",11698,"Room","Emma Donoghue"
"277",12314,"Hotel on the Corner of Bitter and Sweet","Jamie Ford"
"278",12553,"The Tipping Point: How Little Things Can Make a Big Difference","Malcolm Gladwell"
"279",14727,"Emotional Intelligence 2.0","Travis Bradberry"
"280",12799,"Outliers: The Story of Success","Malcolm Gladwell"
"281",14757,"Forks Over Knives: The Plant-Based Way to Health. The #1 New York Times Bestseller","Gene Stone"
"282",13771,"The Girl Who Played with Fire (Millennium Series)","Stieg Larsson"
"283",14243,"Hungry Girl 300 Under 300: 300 Breakfast, Lunch & Dinner Dishes Under 300 Calories","Lisa Lillien"
"284",11871,"The Alchemist","Paulo Coelho"
"285",11741,"Getting Things Done: The Art of Stress-Free Productivity","David Allen"
"286",11315,"The Invention of Hugo Cabret","Brian Selznick"
"287",14513,"Now, Discover Your Strengths: The revolutionary Gallup program that shows you how to develop your unique talents and strengths","Gallup"
"288",12996,"Drive: The Surprising Truth About What Motivates Us","Daniel H. Pink"
"289",11931,"Smokin' Seventeen (Stephanie Plum)","Janet Evanovich"
"290",12770,"Moleskine Classic Notebook, Hard Cover, Large (5"" x 8.25"") Ruled/Lined, Black, 240 Pages","Moleskine Store"
"291",14096,"The Big Short: Inside the Doomsday Machine","Michael Lewis"
"292",14379,"Born to Run: A Hidden Tribe, Superathletes, and the Greatest Race the World Has Never Seen","Christopher McDougall"
"293",13157,"The Official Guide for GMAT Review","GMAC (Graduate Management Admission Council)"
"294",12260,"Fifty Shades Of Grey: Book One of the Fifty Shades Trilogy (Fifty Shades Of Grey Series, 1)","E L James"
"295",13227,"Fifty Shades Darker","E L James"
"296",13124,"Fifty Shades Freed: Book Three of the Fifty Shades Trilogy (Fifty Shades of Grey Series) (English Edition) (Fifty Shades Of Grey Series, 3)","E L James"
"297",12731,"The Hunger Games (Book 1)","Suzanne Collins"
"298",13341,"StrengthsFinder 2.0","Gallup"
"299",12226,"Fifty Shades Trilogy (Fifty Shades of Grey / Fifty Shades Darker / Fifty Shades Freed)","E L James"
"300",12185,"Catching Fire (The Hunger Games)","Suzanne Collins"
"301",11269,"Mockingjay (The Hunger Games)","Suzanne Collins"
"302",11267,"The Third Wheel (Diary of a Wimpy Kid, Book 7)","Jeff Kinney"
"303",13789,"No Easy Day: The Autobiography of a Navy Seal: The Firsthand Account of the Mission That Killed Osama Bin Laden","Mark Owen"
"304",11783,"The Hunger Games Trilogy Boxed Set","Suzanne Collins"
"305",13553,"Gone Girl","Gillian Flynn"
"306",13445,"The Mark of Athena (Heroes of Olympus, Book 3)","Rick Riordan"
"307",12479,"The Official SAT Study Guide","The College Board"
"308",11400,"Game of Thrones Boxed Set: A Game of Thrones/A Clash of Kings/A Storm of Swords/A Feast for Crows","George R.R. Martin"
"309",11103,"Killing Kennedy: The End of Camelot","Bill O'Reilly"
"310",13723,"Publication Manual of the American Psychological Association, 6th Edition","American Psychological Association"
"311",12471,"Killing Lincoln: The Shocking Assassination that Changed America Forever (Bill O'Reilly's Killing Series)","Bill O'Reilly"
"312",13264,"Unbroken: A World War II Story of Survival, Resilience, and Redemption","Laura Hillenbrand"
"313",13197,"Proof of Heaven: A Neurosurgeon's Journey into the Afterlife","Eben Alexander"
"314",14282,"The 5 Love Languages: The Secret to Love That Lasts","Gary Chapman"
"315",11577,"Barefoot Contessa Foolproof: Recipes You Can Trust: A Cookbook","Ina Garten"
"316",14156,"Thinking, Fast and Slow","Daniel Kahneman"
"317",12041,"The Casual Vacancy","J.K. Rowling"
"318",13090,"The Harbinger: The Ancient Mystery that Holds the Secret of America's Future","Jonathan Cahn"
"319",13983,"The Power of Habit: Why We Do What We Do in Life and Business","Charles Duhigg"
"320",13338,"Steve Jobs","Walter Isaacson"
"321",13812,"Wheat Belly: Lose the Wheat, Lose the Weight, and Find Your Path Back to Health","William Davis"
"322",12393,"Oh, the Places You'll Go!","Dr. Seuss"
"323",12020,"The 7 Habits of Highly Effective People: Powerful Lessons in Personal Change","Stephen R. Covey"
"324",14284,"The Five Dysfunctions of a Team: A Leadership Fable, 20th Anniversary Edition","Patrick Lencioni"
"325",11986,"Quiet: The Power of Introverts in a World That Can't Stop Talking","Susan Cain"
"326",12331,"The Great Gatsby: The Only Authorized Edition","F. Scott Fitzgerald"
"327",11335,"The Racketeer","John Grisham"
